,tweet,id,time,user,location,favourites,retweet-count,hashtags
1536,@RobinBellerby Where did you take this photo? May we use it for our syndicated news coverage with credit to you?,1078732441504923648,2018-12-28 19:20:30,8510242,"State College, PA",0,1,[]
1537,"@angelsavant Did you take this photo? If so, may we use it for our syndicated news coverage with credit to you?",1078731988608212992,2018-12-28 19:18:42,8510242,"State College, PA",1,1,[]
1538,"Retiree Roy Olson digs out from a fresh #snowfall on December 27 in Santa Fe, New Mexico. (AP Photo/Morgan Lee)

Us… https://t.co/iCZPTjk3l7",1078712174036615168,2018-12-28 17:59:58,8510242,"State College, PA",10,2,[snowfall]
1539,"@biszahagirl Hi Darla, nice video! Did you record this and where? Can we share this on our syndicated news coverage with credit to you?",1078712136300404740,2018-12-28 17:59:49,8510242,"State College, PA",0,0,[]
1540,@ChiNeighbor Hello! We hope you're staying safe and warm. Did you record this video? Can we share it on our syndica… https://t.co/SPFX1sa11Q,1078711668199358464,2018-12-28 17:57:57,8510242,"State College, PA",1,0,[]
1541,"@myonlysecret Hi, we hope you are safe. Did you take this photo? If so, may we use it for our syndicated news coverage with credit to you?",1078710398164103175,2018-12-28 17:52:55,8510242,"State College, PA",1,0,[]
1542,"@malt_o_meal_23 Hi Nick, we hope you are safe. Did you take these photos? If so, may we use them for our syndicated… https://t.co/SGnBODjdEe",1078710297345560576,2018-12-28 17:52:31,8510242,"State College, PA",1,0,[]
1543,"@ShuberL Hi, we hope you are safe. Did you take this photo? If so, may we use it for our syndicated news coverage with credit to you?",1078710151882907648,2018-12-28 17:51:56,8510242,"State College, PA",0,0,[]
1544,"@LynneSturtevant Hi Lynn, we hope you are safe. Did you take this photo? If so, may we use it for our syndicated ne… https://t.co/F3h2FRYBdd",1078707687527976960,2018-12-28 17:42:08,8510242,"State College, PA",0,0,[]
1545,@xatruchNMT Thank you.,1078704777415004164,2018-12-28 17:30:34,8510242,"State College, PA",1,0,[]
1546,"@xatruchNMT Hi Joseph, we hope you are safe. Did you take these photos? If so, may we use them for our syndicated n… https://t.co/wUbImE4daK",1078702336455950338,2018-12-28 17:20:52,8510242,"State College, PA",1,0,[]
1547,Vuzix and AccuWeather Partner to Deliver First Augmented Reality Weather Content to Smart Glasses Users Across the… https://t.co/sS4tfEivsd,1078682152399704064,2018-12-28 16:00:40,8510242,"State College, PA",2,4,[]
1548,@kathleenlav Thank you.,1078482756479393793,2018-12-28 02:48:21,8510242,"State College, PA",0,0,[]
1549,@mbenchi10 Thank you.,1078481401962475520,2018-12-28 02:42:58,8510242,"State College, PA",0,0,[]
1550,"@inztinkt Did you record this video? If so, may we use it for our syndicated news coverage with credit to you?",1078481191702007809,2018-12-28 02:42:07,8510242,"State College, PA",0,0,[]
1551,@BradyvVVV Thank you.,1078480839065980928,2018-12-28 02:40:43,8510242,"State College, PA",0,0,[]
1552,"@mbenchi10 Did you record this video? If so, may we use it for our syndicated news coverage with credit to you?",1078480746833215488,2018-12-28 02:40:21,8510242,"State College, PA",0,0,[]
1553,"@BradyvVVV Did you record this video? If so, may we use it for our syndicated news coverage with credit to you?",1078480527781437440,2018-12-28 02:39:29,8510242,"State College, PA",2,0,[]
1554,"@kathleenlav Did you record this video? If so, may we use it for our syndicated news coverage with credit to you?",1078480396780818439,2018-12-28 02:38:58,8510242,"State College, PA",1,0,[]
1555,@OtterTailCounty Looks slippery! We hope you're safe. Did you record this? Can we share this on our syndicated news… https://t.co/7MhKnPMuai,1078436442228080642,2018-12-27 23:44:18,8510242,"State College, PA",0,0,[]
1556,@homietommyg Thank you!,1078430893625221121,2018-12-27 23:22:15,8510242,"State College, PA",0,0,[]
1557,"@homietommyg Wow! Did you record this Noah, where is this from? Can we share it on our syndicated news coverage with credit to you?",1078430041653108736,2018-12-27 23:18:52,8510242,"State College, PA",1,0,[]
1558,@aelizabethl10 Thank you.,1078393909208846337,2018-12-27 20:55:18,8510242,"State College, PA",1,0,[]
1559,"@aelizabethl10 We hope you are safe. Did you record this video? If so, may we use it for our syndicated news coverage with credit to you?",1078392947660505089,2018-12-27 20:51:28,8510242,"State College, PA",0,0,[]
1560,"Your home can survive a wildfire: How you can potentially save your house from devastating damage

Listen to the Ac… https://t.co/9ufgiywPBe",1078387570323656705,2018-12-27 20:30:06,8510242,"State College, PA",2,2,[]
1561,"@prairieguy2016 Hi Neil, nice video. Did you record this and where? Can we share it on our syndicated news coverage with credit to you?",1078363799520980993,2018-12-27 18:55:39,8510242,"State College, PA",2,0,[]
1562,"@ToddWayneVeal Hi Todd, amazing video of the storm! Did you record this yourself? Can we share this on our syndicat… https://t.co/dFCoMZscsW",1078363446146674689,2018-12-27 18:54:15,8510242,"State College, PA",0,0,[]
1563,"@JoeRekl Nice video, did you record this? Can we share this on our syndicated news coverage with credit to you?",1078363129652875266,2018-12-27 18:52:59,8510242,"State College, PA",1,0,[]
1564,"@kschones84 Hi there, we hope you're staying safe. Did you record this? Can we share it on our syndicated news coverage with credit to you?",1078359997027889152,2018-12-27 18:40:32,8510242,"State College, PA",1,0,[]
1565,"@justinfrantzen6 @AccuRayno Hi Justin, we see you tagged @AccuRayno are we good to share this on our syndicated new… https://t.co/PEEFbkr4gH",1078359534962397184,2018-12-27 18:38:42,8510242,"State College, PA",1,0,[]
1566,"#Hoarfrost covered leaves hang down from a tree at a cold winter day in Uttenweiler-Aderzhofen, south west Germany.… https://t.co/C7JtVV3ciO",1078357387088707586,2018-12-27 18:30:10,8510242,"State College, PA",17,2,[Hoarfrost]
1567,"This impressive #shelfcloud was spotted near Abilene, Texas, by @ReedTimmerAccu yesterday: https://t.co/DzRwFRcrqD",1078326774403084290,2018-12-27 16:28:32,8510242,"State College, PA",270,52,[shelfcloud]
1568,@rguthrie0209 Thank you.,1078112816857522176,2018-12-27 02:18:20,8510242,"State College, PA",0,0,[]
1569,"@rguthrie0209 We hope you are safe. Did you take these photos? If so, may we use them for our syndicated news coverage with credit to you?",1078112203138580480,2018-12-27 02:15:54,8510242,"State College, PA",0,0,[]
1570,@kaitlinrutt Thank you!,1078072490038038528,2018-12-26 23:38:05,8510242,"State College, PA",1,0,[]
1571,"@kaitlinrutt Hi Kaitlin, great video! Can we share this on our syndicated news coverage with credit to you?",1078063216754860033,2018-12-26 23:01:14,8510242,"State College, PA",0,0,[]
1572,"@cwalonen Great video, did you record this? Can we share this on our syndicated news coverage with credit to you?",1078037500143259648,2018-12-26 21:19:03,8510242,"State College, PA",0,0,[]
1573,@darkglassphoto Beautiful video! Did you record this? Can we share this on our syndicated news coverage with credit to you?,1078037154020970509,2018-12-26 21:17:41,8510242,"State College, PA",0,0,[]
1574,@JEROMYCARTER1 We hope you're safe! Did you record this? Can we share this on our syndicated news coverage with credit to you?,1078034879949033496,2018-12-26 21:08:38,8510242,"State College, PA",1,0,[]
1575,"@LeftHandedRach Nice video Rachel, did you record this? Can we share this on our syndicated news coverage with credit to you?",1078003151192625163,2018-12-26 19:02:34,8510242,"State College, PA",0,0,[]
1576,"@enderFP Nice video, did you record this? Can we share it on our syndicated news coverage with credit to you?",1078003003389603841,2018-12-26 19:01:58,8510242,"State College, PA",1,0,[]
1577,"@larrybehrens Hey Larry, Nice video! Hope you're staying warm. Can we share this on our syndicated news coverage with credit to you?",1077993912738942976,2018-12-26 18:25:51,8510242,"State College, PA",1,0,[]
1578,"@Manaosulol Hello there, nice video! Did you record this today? Can we share it on our syndicated news coverage with credit to you?",1077655449313443841,2018-12-25 20:00:55,8510242,"State College, PA",1,1,[]
1579,"@Pretty_Eyezxx Merry Christmas! Nice video, did you record this? Can we share it on our syndicated news coverage with credit to you?",1077649684821352448,2018-12-25 19:38:01,8510242,"State College, PA",0,1,[]
1580,RT @AccuAstronomy: Astronauts aboard the International Space Station are celebrating a special cosmic holiday in zero gravity: https://t.co…,1077600735985057792,2018-12-25 16:23:30,8510242,"State College, PA",0,11,[]
1581,A nor’easter was hitting on Christmas night 1776 when General George Washington led his troops across the icy Delaw… https://t.co/L0hflfhQnv,1077565526602338304,2018-12-25 14:03:36,8510242,"State College, PA",30,7,[]
1582,"@titotito Nice video, did you record this? Where exactly is it from? Can we share it on our syndicated news coverage with credit to you?",1077293573962457090,2018-12-24 20:02:57,8510242,"State College, PA",0,1,[]
1583,"@RichardOHanlon4 Great video, Richard. Did you record this? Can we share it on our syndicated news coverage with credit to you?",1077293412171288576,2018-12-24 20:02:19,8510242,"State College, PA",1,2,[]
1584,"Indonesia's Krakatau Volcano is still erupting after triggering a tsunami on December 22, that left hundreds of peo… https://t.co/ZaZmgrbyyU",1077255257518948352,2018-12-24 17:30:42,8510242,"State College, PA",40,24,[]
1585,RT @ReedTimmerAccu: Look who it is! It’s @AccuRayno breaking down the weather at Loves Gas Station in Boonville MO https://t.co/KyArnTsEKK,1077210864611180546,2018-12-24 14:34:18,8510242,"State College, PA",0,5,[]
1586,"What's the history behind dreaming of a 'White Christmas?' 

Listen to the AccuWeather Daily podcast on your Google… https://t.co/Ttd0ZvciVK",1076915470962442242,2018-12-23 19:00:31,8510242,"State College, PA",3,1,[]
1587,"A stunning #lightning display illuminates the skies over Marvel Loch, Western Australia. (Instagram/ @jordancantelo… https://t.co/kAiPS3Gk8o",1076885357474521088,2018-12-23 17:00:51,8510242,"State College, PA",23,8,[lightning]
1588,"5 historic Christmas Day snowstorms

Listen to the AccuWeather Daily podcast on your Google Assistant-enabled devic… https://t.co/BXJUD0PVsc",1076568183690141698,2018-12-22 20:00:31,8510242,"State College, PA",4,1,[]
1589,"Strong waves break over the Malecon seawall as a result of heavy winds flooding urban areas in Havana, Cuba, Friday… https://t.co/VEHThrAEtT",1076538025029578752,2018-12-22 18:00:40,8510242,"State College, PA",14,10,[]
1590,"Avoid a tragedy this holiday season: 7 tips for preventing a Christmas tree-related fire

Listen to the AccuWeather… https://t.co/RjG8Rcp7Tj",1076205925030129664,2018-12-21 20:01:02,8510242,"State College, PA",6,3,[]
1591,Just in time for Christmas! The @esa Mars Express captured this festive photo of snow in the Korolev crater found o… https://t.co/mbvcsBodCs,1076160787222315010,2018-12-21 17:01:40,8510242,"State College, PA",29,12,[]
1592,@DJKingBori Thank you very much!,1076137450387529729,2018-12-21 15:28:56,8510242,"State College, PA",0,1,[]
1593,"@DJKingBori Hi Javi, we hope you're safe and staying dry. Did you record this? Can we share it on our syndicated ne… https://t.co/q0U6BsVHpB",1076135863036321796,2018-12-21 15:22:38,8510242,"State College, PA",0,2,[]
1594,"The #WinterSoltice is tomorrow! Here's everything you need to know about the shortest day of the year. 

https://t.co/pBwiB8Dgi6",1075918873550094336,2018-12-21 01:00:23,8510242,"State College, PA",14,9,[WinterSoltice]
1595,@gocampcasey Thank you and stay safe.,1075897038016008192,2018-12-20 23:33:37,8510242,"State College, PA",0,1,[]
1596,"@gocampcasey Did you record this video? If so, may we use this for our syndicated news coverage with credit to you?",1075893454981476352,2018-12-20 23:19:23,8510242,"State College, PA",1,1,[]
1597,@zsincraugh87 Thank you.,1075886577577091073,2018-12-20 22:52:03,8510242,"State College, PA",0,1,[]
1598,"@zsincraugh87 We hope you are safe! Did you take this photo? If so, may we use it for our syndicated news coverage with credit to you?",1075882486046040066,2018-12-20 22:35:48,8510242,"State College, PA",0,1,[]
1599,"@RonDogExclusive Did you take these photos? If so, may we use them for our syndicated news coverage with credit to you?",1075881542206001153,2018-12-20 22:32:03,8510242,"State College, PA",1,1,[]
1600,"What you can do to help prevent deadly, devastating wildfires from occurring

Listen to the AccuWeather Daily podca… https://t.co/vf0JiAOecG",1075873651793244160,2018-12-20 22:00:42,8510242,"State College, PA",0,0,[]
1601,@fattymattysf Thank you.,1075870015163904001,2018-12-20 21:46:14,8510242,"State College, PA",0,0,[]
1602,"@fattymattysf We hope everyone is safe. Did you take these photos? If so, may we use them for our syndicated news c… https://t.co/QKdwBK9EbV",1075863706402283520,2018-12-20 21:21:10,8510242,"State College, PA",1,0,[]
1603,"@JoshTerry9 Thank you, and stay safe.",1075856911336128512,2018-12-20 20:54:10,8510242,"State College, PA",0,0,[]
1604,"@SeaPeee Thank you, and stay safe.",1075850878509232128,2018-12-20 20:30:12,8510242,"State College, PA",0,0,[]
1605,"@JoshTerry9 Did you take these photos? If so, may we use them for our syndicated news coverage with credit to you?",1075850109693374464,2018-12-20 20:27:09,8510242,"State College, PA",0,0,[]
1606,"@SeaPeee We hope everyone is safe. Did you take these photos? If so, may we use them for our syndicated news coverage with credit to you?",1075849731941785601,2018-12-20 20:25:39,8510242,"State College, PA",0,0,[]
1607,AccuWeather Ready LIVE: Winter cardiac and respiratory care. https://t.co/qEsGPRytap,1075829453287317504,2018-12-20 19:05:04,8510242,"State College, PA",3,0,[]
1608,"#Fog floats over a landscape at the village of Soshartyan, northeast of Budapest, Hungary on December 19. (Peter Ko… https://t.co/RhnzbXefAn",1075798266976059392,2018-12-20 17:01:08,8510242,"State College, PA",22,3,[Fog]
1609,"Large hail fell in Sydney, Australia Wednesday. https://t.co/mO9JYuc2xQ",1075776368586121217,2018-12-20 15:34:07,8510242,"State College, PA",45,19,[]
1610,@LJohnsonWX Thank you.,1075468308252643328,2018-12-19 19:10:00,8510242,"State College, PA",1,0,[]
1611,AccuWeather Chief Broadcast Meteorologist @AccuRayno said major travel delays are likely with the East Coast storm. https://t.co/CWteDMJk3d,1075466003205754886,2018-12-19 19:00:51,8510242,"State College, PA",4,1,[]
1612,"@LJohnsonWX Logan, did you take all of these photos of the tornado damage? If so, may we use them for our syndicate… https://t.co/fyjEIfKfHn",1075465825065320448,2018-12-19 19:00:08,8510242,"State College, PA",1,0,[]
1613,"#Bestof2018 Weather Photos: Extreme flooding in Ellicott City, Maryland, May 27, 2018. (Photo/Max Robinson) 

See a… https://t.co/0NG3z0JW9M",1075458297799426048,2018-12-19 18:30:13,8510242,"State College, PA",15,9,[Bestof2018]
1614,AccuWeather Ready LIVE: Winter cardiac and respiratory care https://t.co/7YFcjqKINy,1075451713493000192,2018-12-19 18:04:04,8510242,"State College, PA",11,5,[]
1615,Join us LIVE at 1 PM ET to talk winter cardiac and respiratory care with Frank Cianfrani from Centre Lifelink EMS.… https://t.co/8dh7ElPO1O,1075420285061349376,2018-12-19 15:59:10,8510242,"State College, PA",6,1,[]
1616,"Helicopter footage showed the severe damage from a tornado Tuesday in Port Orchard, Washington: https://t.co/1RyHWGutyU",1075397967581011968,2018-12-19 14:30:30,8510242,"State College, PA",11,9,[]
1617,"This is what the tornado in Port Orchard, Washington looked like yesterday as it was moving behind a Wal-Mart: https://t.co/vOSHPYBfau",1075384068362121219,2018-12-19 13:35:16,8510242,"State College, PA",157,59,[]
1618,"Only YOU can prevent forest fires – but more specifically, here’s how: https://t.co/SffuKUxxFY",1075185202232733697,2018-12-19 00:25:02,8510242,"State College, PA",8,7,[]
1619,"When a wildfire is 100-percent 'contained,' does that mean the blaze is completely extinguished? https://t.co/ubX66qyYts",1075106558483279872,2018-12-18 19:12:32,8510242,"State College, PA",5,2,[]
1620,"Best of #2018 Weather Photos: The Montecito, California debris flow overtook homes Jan. 12, 2018. (AP Photo/Marcio… https://t.co/bdRg2kd0vI",1075094288797720578,2018-12-18 18:23:47,8510242,"State College, PA",2,4,[]
1621,"LOL: High winds caused an inflatable snowman “fight” in Brookings, Oregon yesterday: https://t.co/4aCRLQs8iy",1075044764137984001,2018-12-18 15:06:59,8510242,"State College, PA",12,1,[]
1622,Voyager 2 was launched in 1977 but has just this month left our solar system. https://t.co/A9LKXZUt3e,1074820342282104835,2018-12-18 00:15:13,8510242,"State College, PA",47,21,[]
1623,"RT @ReedTimmerAccu: NEW: incredible powder day after quick storm near Donner Pass, CA at @sugarbowlresort 

Thank you JD Hoss and Bill, @10…",1074753436741234688,2018-12-17 19:49:21,8510242,"State College, PA",0,25,[]
1624,@MarionSyversen Great video! Did you record this and where? Can we share this on our syndicated news coverage with credit to you?,1074747644638101509,2018-12-17 19:26:20,8510242,"State College, PA",1,1,[]
1625,@GulfPower Beautiful! Thanks for sharing!,1074746735161958400,2018-12-17 19:22:44,8510242,"State College, PA",1,1,[]
1626,"Best of #2018: Jan 4, 2018 Blizzard in Ocean Grove, New Jersey. (AP Photo/Julio Cortez)

See all 36 crazy weather p… https://t.co/8IKMJuzkLU",1074691484371144705,2018-12-17 15:43:11,8510242,"State College, PA",11,3,[]
1627,"For skiers, there are 5 main types of snow on the slopes: Powder, Crud, Crust, Slush, and Ice.#ski #skiing #snow https://t.co/hJjFh62shO",1074419041387851777,2018-12-16 21:40:35,8510242,"State College, PA",112,34,"[ski, skiing, snow]"
1628,"These steps down into a train station looked more like a waterfall after heavy #rain in #Melbourne, #Australia Frid… https://t.co/cElXimKph1",1074352372598620160,2018-12-16 17:15:40,8510242,"State College, PA",46,16,"[rain, Melbourne, Australia]"
1629,"A man in Linville, North Carolina is lucky to be alive after a gas station canopy collapsed under the weight of las… https://t.co/CTSVtNrFea",1074085034234208263,2018-12-15 23:33:22,8510242,"State College, PA",256,104,[]
1630,"@StaceyH54298286 Hi Stacy, great pictures. Did you take these? If so, can we share them on our syndicated news coverage with credit to you?",1073929328323411968,2018-12-15 13:14:39,8510242,"State College, PA",2,1,[]
1631,"What are Chinook Winds?

Listen to the AccuWeather Daily podcast on your Google Assistant-enabled device, Amazon Ec… https://t.co/tBuJ2XZB6y",1073699295264735233,2018-12-14 22:00:35,8510242,"State College, PA",5,1,[]
1632,Did you miss the #Geminids last night? You will still have the chance to see Comet 46P/ Wirtanen this weekend! https://t.co/vKQLyXJREE,1073676553404538880,2018-12-14 20:30:12,8510242,"State College, PA",61,30,[Geminids]
1633,"@jed_JC2 Hi Jed, did you record this? Can we share it on our syndicated news coverage with credit to you? Stay safe and dry out there!",1073665441036492800,2018-12-14 19:46:03,8510242,"State College, PA",0,1,[]
1634,"Correction: Wilmington, North Carolina https://t.co/MlKfHMQRIx",1073640155574165505,2018-12-14 18:05:35,8510242,"State College, PA",6,1,[]
1635,"A gorgeous #sunrise in Wilmington, Delaware. (Twitter/ @jpetramala) 

Use #AccuPhoto to share your weather photos w… https://t.co/WOD7tb8W8T",1073631301528444928,2018-12-14 17:30:24,8510242,"State College, PA",55,6,"[sunrise, AccuPhoto]"
1636,Winter weather has a significant impact on our skin health. Learn how to keep your skin protected from the harsh el… https://t.co/PLFpstvhxh,1073601142842671106,2018-12-14 15:30:33,8510242,"State College, PA",7,3,[]
1637,"@kriskaylin Very wet morning down there for you guys, we hope you're safe! Did you record this and may we share it… https://t.co/x2a36AaYt5",1073596594799431686,2018-12-14 15:12:29,8510242,"State College, PA",1,1,[]
1638,@CharlestonBeach We hope everyone down there is safe! Did you record this and may we share it on our syndicated new… https://t.co/7DWoGNfXfd,1073596198987202571,2018-12-14 15:10:54,8510242,"State College, PA",1,1,[]
1639,@ella__dane @MaryCarol_15 Can we share this and your picture? Where exactly is this video from?,1073361367032320006,2018-12-13 23:37:46,8510242,"State College, PA",0,1,[]
1640,"@MaryCarol_15 Hi Mary, great picture. Did you take this? Can we share it on our syndicated news coverage with credit to you?",1073358643410690049,2018-12-13 23:26:57,8510242,"State College, PA",0,1,[]
1641,"@offminded88 Hi Dillon, great picture. Did you take this? Can we share it on our syndicated news coverage with credit to you?",1073347925097488385,2018-12-13 22:44:21,8510242,"State College, PA",1,0,[]
1642,It’s the most hazardous time of the year. Outsmart it with @hum by Verizon -- the all-in-one connected car solution… https://t.co/xEe6ciU9Gk,1073321832676278273,2018-12-13 21:00:40,8510242,"State College, PA",3,0,[]
1643,"@JHoebelheinrich Great video, Jon! Did you record this and can we share it on our syndicated news coverage with credit to you?",1073309641575161856,2018-12-13 20:12:14,8510242,"State College, PA",0,0,[]
1644,@maurizioiardino Where exactly is this from?,1073309020977455105,2018-12-13 20:09:46,8510242,"State College, PA",0,0,[]
1645,"Black Ice: How to spot this winter driving danger

Listen to the AccuWeather Daily podcast on your Google Assistant… https://t.co/d2YW4BeMcr",1073306736923168769,2018-12-13 20:00:41,8510242,"State College, PA",8,2,[]
1646,"@JLJ63 Windy for sure! Jody, Can we share this on our syndicated news coverage with credit to you? Was this in Lubbock?",1073298257294622720,2018-12-13 19:27:00,8510242,"State College, PA",0,0,[]
1647,@maurizioiardino Hello there! Hope you're enjoying your day. Can we share this on our syndicated news coverage with credit to you?,1073297988645195777,2018-12-13 19:25:56,8510242,"State College, PA",0,0,[]
1648,@TXGeoscientist Thank you!,1073289775350775811,2018-12-13 18:53:17,8510242,"State College, PA",0,0,[]
1649,@TXGeoscientist Great video! Can we share this on our syndicated news coverage with credit to you?,1073286472588029952,2018-12-13 18:40:10,8510242,"State College, PA",0,0,[]
1650,"@pher0681 Hi Christopher, great video! Can we share this on our syndicated news coverage with credit to you?",1073285532313096195,2018-12-13 18:36:26,8510242,"State College, PA",0,0,[]
1651,"What a pretty sight! A clear #sky accompanied a snowy day in McKenney, #Virginia on December 11 after a #snowstorm… https://t.co/UyRTjj9rjt",1073276641365901312,2018-12-13 18:01:06,8510242,"State College, PA",16,6,"[sky, Virginia, snowstorm]"
1652,The #Geminids peak tonight! Learn more about the most active meteor shower here: https://t.co/DgBSffM18w,1073246371476586496,2018-12-13 16:00:49,8510242,"State College, PA",31,11,[Geminids]
1653,"On this weather satellite image, you can see the #snow that buried parts of #NorthCarolina and #Virginia: https://t.co/EU5eYA1ti1",1072951729480761344,2018-12-12 20:30:01,8510242,"State College, PA",24,4,"[snow, NorthCarolina, Virginia]"
1654,"A rare phenomenon called #LightPillars were seen beaming up to the night #sky in Beloit, Wisconsin on Sunday evenin… https://t.co/xILQzz8rCn",1072936909918355456,2018-12-12 19:31:08,8510242,"State College, PA",42,17,"[LightPillars, sky]"
1655,AccuWeather Ready LIVE: Winter Sports Safety https://t.co/FwR21kKEqR,1072915042608144384,2018-12-12 18:04:14,8510242,"State College, PA",5,2,[]
1656,"Join us at 1 PM today to talk Winter Sports Safety with Jim Bazluki, President of the North Carolina Athletic Train… https://t.co/maJlWuItvX",1072860481357078528,2018-12-12 14:27:26,8510242,"State College, PA",6,5,[]
1657,"From @ReedTimmerAccu : Incredible lenticular clouds were seen over Idaho Springs, Colorado at sunset on Monday: https://t.co/3C75nVfV4e",1072854960604360704,2018-12-12 14:05:29,8510242,"State College, PA",81,23,[]
1658,"Homeowners in this new hurricane-proof neighborhood will live a carbon-free, high-tech lifestyle https://t.co/Drj5bPqb8D",1072839762732552193,2018-12-12 13:05:06,8510242,"State College, PA",7,6,[]
1659,"Adorable bulldog loves sledding in the snow: At the end, it sounds like Instagram/@Dunkin_the_Bulldog says “Again!” https://t.co/5zQMQ1ZOgB",1072642278005637120,2018-12-12 00:00:22,8510242,"State College, PA",38,9,[]
1660,"A rare phenomena called ""light pillars"" was seen beaming up to the night's sky in Beloit, Wisconsin, on Sunday even… https://t.co/bhOfWTO1aI",1072612119068192771,2018-12-11 22:00:32,8510242,"State College, PA",24,8,[]
1661,"Trees, heavy with #snow, fell over on powerlines in Asheville, #NC on Sunday, creating a light show: https://t.co/1vSzUzZiLO",1072536567774883842,2018-12-11 17:00:19,8510242,"State College, PA",15,6,"[snow, NC]"
1662,"The @NCNationalGuard helped an ambulance and its patient who were stuck in the #snow in Burke County, #NC on Decemb… https://t.co/sJ3u8bO0th",1072521607430709250,2018-12-11 16:00:52,8510242,"State College, PA",14,6,"[snow, NC]"
1663,"Are you more likely to binge drink, have alcoholic liver disease if you live in a colder climate? https://t.co/ubEIrqu5B8",1072506331544936448,2018-12-11 15:00:10,8510242,"State College, PA",12,3,[]
1664,Do you know the difference between sleet and graupel? What about hail and sleet? https://t.co/nWPJnHPdK7,1072476269349085188,2018-12-11 13:00:42,8510242,"State College, PA",2,5,[]
