,tweet,id,time,user,location,favourites,retweet-count,hashtags
768,@AeroimagesChris Hello! Nice video. Can we share this on our syndicated news coverage with credit to you?,1093995804942106624,2019-02-08 22:11:40,8510242,"State College, PA",0,0,[]
769,Winter still has its grasp on many locations in the United States -- these steps might help you better prepare for… https://t.co/YpAgnhavXA,1093992872771182592,2019-02-08 22:00:00,8510242,"State College, PA",5,1,[]
770,"@jessicascott714 Hi Jessica, nice video! Can we share this on our syndicated news coverage with credit to you? Where was this recorded?",1093989067732205570,2019-02-08 21:44:53,8510242,"State College, PA",2,0,[]
771,"Looking good, Reed! 👍 https://t.co/RFYvjoixpa",1093987860942938113,2019-02-08 21:40:06,8510242,"State College, PA",9,1,[]
772,"Yes, #Hawaii can get snow and it's thanks to the approaching #KonaLow https://t.co/vp1adONyy4",1093985320264069120,2019-02-08 21:30:00,8510242,"State College, PA",6,2,"[Hawaii, KonaLow]"
773,@HartSeahawks Hello! Great video. We hope you're staying warm and safe! Can we share this on our syndicated news co… https://t.co/mDMVXLWKYR,1093981043210838016,2019-02-08 21:13:00,8510242,"State College, PA",1,1,[]
774,"@GregEastman Nice video, Greg. Did you record this? Can we share this on our syndicated news coverage with credit to you?",1093980680281829376,2019-02-08 21:11:34,8510242,"State College, PA",0,0,[]
775,@NASCARBlueStar Nice video! Did you record this today? Can we share this on our syndicated news coverage with credi… https://t.co/jMnOEnMnYd,1093980446348722183,2019-02-08 21:10:38,8510242,"State College, PA",2,0,[]
776,"@edmuir77 Nice video, Ed! Can we share this on our syndicated news coverage with credit to you?",1093980273811877888,2019-02-08 21:09:57,8510242,"State College, PA",0,0,[]
777,"Find out why public works in Washington is using beet juice, that's right BEET JUICE, with salt brine to help plow… https://t.co/e2KicSc9q9",1093973996067082240,2019-02-08 20:45:00,8510242,"State College, PA",24,11,[]
778,"Not only was last December the second warmest, but 2018 as a whole was the fourth warmest year on record: https://t.co/11v4IxFZLa",1093970221377957888,2019-02-08 20:30:00,8510242,"State College, PA",55,12,[]
779,"Sliding on ice is bad enough, but not the coffee! 😭 https://t.co/B6nJsSIUvN https://t.co/Td2ewaG2oH",1093962675795755008,2019-02-08 20:00:01,8510242,"State College, PA",14,1,[]
780,"@nettebini Hi Annette, nice video! Did you record this? Can we share it on our syndicated news coverage with credit to you?",1093961926361710592,2019-02-08 19:57:02,8510242,"State College, PA",0,0,[]
781,"@JenniferKay1013 Beautiful video, Jennifer! Did you record this? Can we share this on our syndicated news coverage with credit to you?",1093961587478675457,2019-02-08 19:55:41,8510242,"State College, PA",1,0,[]
782,"@Sceruttiphoto Hi Sherrie, did you record this? Can we share this on our syndicated news coverage with credit to you?",1093960180906242050,2019-02-08 19:50:06,8510242,"State College, PA",0,0,[]
783,"@chrismore Hi Chris, nice videos did you record both of them? And would we be able to share this on our syndicated… https://t.co/IZgKqJkSYj",1093957633952940032,2019-02-08 19:39:59,8510242,"State College, PA",0,0,[]
784,RT @lonepeakfutures: Fluffy the cat representing for Montana. #toughness https://t.co/90ALVrIthQ,1093957327860977665,2019-02-08 19:38:46,8510242,"State College, PA",0,4,[toughness]
785,How do you like these 'ghost apples'👻🍎? https://t.co/pGTTcpCo8i,1093955123481587714,2019-02-08 19:30:00,8510242,"State College, PA",7,1,[]
786,@onemoonatatime_ Nice video! Did you record this today? Can we share this on our syndicated news coverage with credit to you?,1093952783122923520,2019-02-08 19:20:42,8510242,"State College, PA",1,0,[]
787,"@j_taggs Hi Seth, nice video did you record this today? Can we share this on our syndicated news coverage with credit to you?",1093952284227239936,2019-02-08 19:18:43,8510242,"State College, PA",0,0,[]
788,@JasonKrump Thank you! We will be passing it along to our video team to edit to show on the AccuWeather Network at… https://t.co/numHXHB90a,1093950024269131776,2019-02-08 19:09:45,8510242,"State College, PA",0,0,[]
789,"@JasonKrump Hi Jason, did you record this video today? Can we share it on our syndicated news coverage with credit to you?",1093948200166346753,2019-02-08 19:02:30,8510242,"State College, PA",1,0,[]
790,"Oh the weather outside is frightful, but these cold weather experiments are delightful! Learn how to do these viral… https://t.co/BQBhODiN75",1093948061766815744,2019-02-08 19:01:57,8510242,"State College, PA",4,1,[]
791,"@CandiceMcF Candice, did you record this video today? Can we share it on our syndicated news coverage with credit to you?",1093947688444416001,2019-02-08 19:00:28,8510242,"State College, PA",1,0,[]
792,"@Zoro4Me3 Nice video, did you record this today? Where exactly is this from? Can we share it on our syndicated news… https://t.co/K3SI5WPJpQ",1093945546321084416,2019-02-08 18:51:57,8510242,"State College, PA",0,0,[]
793,"@WaWxChasers Hello, great video! Hope it's a safe ride. Did you record this? Can we share this video on our syndica… https://t.co/pK3wTkC1OL",1093944133750874112,2019-02-08 18:46:20,8510242,"State College, PA",2,0,[]
794,"This #pup, Balto, was jumping for joy in the #snow earlier this week in Reno, Nevada.
(Instagram- klovehealing)

Us… https://t.co/I6t6rPh45C",1093938780166373376,2019-02-08 18:25:04,8510242,"State College, PA",27,6,"[pup, snow]"
795,"#ICYMI: A deadly storm pummeled the West Coast this week, heavy #snow hit southern England and more top #weather st… https://t.co/FKb4aGoh25",1093936247586934784,2019-02-08 18:15:00,8510242,"State College, PA",2,0,"[ICYMI, snow, weather]"
796,"@RandySmall Hi Randy, we hope you're staying warm! Did you record this? Can we share it on our syndicated news coverage with credit to you?",1093932619027439621,2019-02-08 18:00:35,8510242,"State College, PA",0,0,[]
797,".@AmyFreeze7 we know it's a little early for #supercatsaturday, but we thought this cat was deserving of the title!… https://t.co/DzsDv0vtqM",1093932479625510913,2019-02-08 18:00:02,8510242,"State College, PA",50,11,[supercatsaturday]
798,"@JannaDyck Hi Janna, did you record this video? Can we share this on our syndicated news coverage with credit to you?",1093932453134327810,2019-02-08 17:59:55,8510242,"State College, PA",0,0,[]
799,@NadiasLens Thanks for pointing that out Nadia!,1093931667729862662,2019-02-08 17:56:48,8510242,"State College, PA",1,0,[]
800,"""I will always put lives ahead of a TV show..."" @katymorganwx dealt with harsh criticism after interrupting an epis… https://t.co/j9HxbpeVrd",1093928697428553728,2019-02-08 17:45:00,8510242,"State College, PA",8,4,[]
801,"Freezing rain in Michigan creates stunning'Ghost apples'
https://t.co/pGTTcpTYZQ",1093924924480081920,2019-02-08 17:30:00,8510242,"State College, PA",71,21,[]
802,"These adorable African painted dog pups are having a blast frolicking in the #snow at the Oregon Zoo. 
https://t.co/kgtyeQu5S3",1093921148566491136,2019-02-08 17:15:00,8510242,"State College, PA",6,2,[snow]
803,Dan Burnett from @SCrescuegroup tells the story of the harrowing rescue his #avalanche dog made despite eating a fe… https://t.co/SGe3msIs8M,1093917378017222656,2019-02-08 17:00:01,8510242,"State College, PA",5,1,[avalanche]
804,"It's snowing up! ❄️❄️
https://t.co/EVahdKeaXz https://t.co/4Ep9denok0",1093909822909571073,2019-02-08 16:30:00,8510242,"State College, PA",33,5,[]
805,"@dorsetpolice Great pic. Did a member of your police force take it? If so, may we use it in our syndicated coverage with credit to you?",1093902414984429568,2019-02-08 16:00:34,8510242,"State College, PA",0,0,[]
806,"You've seen the stunning images on social media -- now learn how to do the boiling water trick yourself! 
https://t.co/c1clRx670N",1093902276748443648,2019-02-08 16:00:01,8510242,"State College, PA",5,2,[]
807,Video shows just how hardcore avalanche control work is. https://t.co/d2w4IW0VZd https://t.co/zx2hRNgeTD,1093887178013323265,2019-02-08 15:00:01,8510242,"State College, PA",134,43,[]
808,"Flooding, ice, and ice flooding caused chaos across the nation this week. Find out what happened:… https://t.co/2r84IByNxY",1093860526747197440,2019-02-08 13:14:07,8510242,"State College, PA",6,2,[]
809,No more missed days due to snow? Some schools are looking into eLearning so that inclement weather doesn't get in t… https://t.co/f1PWGQZlli,1093856982438576131,2019-02-08 13:00:02,8510242,"State College, PA",9,3,[]
810,"Icy conditions caused this horrifying scene in Missouri.
https://t.co/TCjIaDgRqJ https://t.co/cQGFsodKjr",1093842011256438784,2019-02-08 12:00:32,8510242,"State College, PA",28,11,[]
811,"This officer has an important message for motorists:
https://t.co/lnCNRpMWe6 https://t.co/o4K0a6Mgek",1093811862108557313,2019-02-08 10:00:44,8510242,"State College, PA",10,5,[]
812,"Heavy rains have caused trash to line this California beach.
https://t.co/DCVyHQ8HGc https://t.co/10i13bZ4FR",1093781645008748545,2019-02-08 08:00:40,8510242,"State College, PA",4,5,[]
813,"Watch the moment this ice dam breaks on Taughanncok Creek, NY.
https://t.co/sRrelV4KAY https://t.co/di8vR9N0fw",1093736224005726209,2019-02-08 05:00:11,8510242,"State College, PA",15,5,[]
814,"This adorable dog desperately tries to catch the snow his owner is shoveling:
https://t.co/W37y6MNmmD",1093721109613240320,2019-02-08 04:00:07,8510242,"State College, PA",4,1,[]
815,"Fluctuating warm and cold weather can cause potholes to form – creating the potential for costly car damage.
https://t.co/vv9Rbk6qB4",1093706030293364737,2019-02-08 03:00:12,8510242,"State College, PA",3,1,[]
816,"Ice jams caused this creek near Buffalo, New York to flood this community:
https://t.co/2yf8vEfEhI https://t.co/rSA9zPVU6t",1093690963137126402,2019-02-08 02:00:20,8510242,"State College, PA",19,15,[]
817,"When harsh winter weather hits, it can affect pets just as much as people.
https://t.co/zhT6mqdJlE",1093675892944064512,2019-02-08 01:00:27,8510242,"State College, PA",2,1,[]
818,"Although it may be tempting to leave your car to warm up, this puts your belongings at risk. https://t.co/cUylWIPFGT",1093660683986595841,2019-02-08 00:00:00,8510242,"State College, PA",4,1,[]
819,HEARTWARMING: A healthy baby boy is born amid an ice storm. https://t.co/R4YZaE3ZU0 https://t.co/IpRZnQITnP,1093653203265163264,2019-02-07 23:30:17,8510242,"State College, PA",20,6,[]
820,RT @AccuAstronomy: Check out this incredible video from the South Pole! A man has spent the last 14 winters at the bottom of the Earth. He…,1093651080381116417,2019-02-07 23:21:51,8510242,"State College, PA",0,35,[]
821,VOLUME UP: Frozen bubble pops with a satisfying noise in subzero temperatures. https://t.co/bVa2CBaPvM,1093645662380527616,2019-02-07 23:00:19,8510242,"State College, PA",10,4,[]
822,"After being left in the cold and snow in Montana, vet's were not sure if ""Fluffy"" would make it. See her recovery h… https://t.co/bEld6Dqyz9",1093638035344748547,2019-02-07 22:30:01,8510242,"State College, PA",14,8,[]
823,"The Northern Lights reveal what appears to be a phoenix forming in the sky:
https://t.co/nPyR0qlfMX",1093630665009086464,2019-02-07 22:00:43,8510242,"State College, PA",16,4,[]
824,"RT @KBakesWx: Calling all juniors (and seniors who will be graduating in December), you have less than 24 hours to apply for the @accuweath…",1093628050867187714,2019-02-07 21:50:20,8510242,"State College, PA",0,20,[]
825,"Few things reflect the power of nature and weather like avalanches. On this week's #podcast, @ReginaMillerWX sits d… https://t.co/Vh20IEEhtW",1093622934051086336,2019-02-07 21:30:00,8510242,"State College, PA",2,1,[podcast]
826,What does this spring have in store for you? Check out our more detailed forecast here: https://t.co/Qhnfi6Qn6c https://t.co/10sWuXlX90,1093615385679675395,2019-02-07 21:00:00,8510242,"State College, PA",10,4,[]
827,"Move, Bison! Get out the way

https://t.co/fBnpNvNELW",1093607833860489217,2019-02-07 20:30:00,8510242,"State College, PA",4,1,[]
828,"@hemming_hawing Hi Laura, we hope it was a safe walk! Can we share this video on our syndicated news coverage with credit to you?",1093607790759809026,2019-02-07 20:29:50,8510242,"State College, PA",0,0,[]
829,"@SlushyWx Hi Isaac, did you record this? Can we share it on our syndicated news coverage with credit to you?",1093606247717367818,2019-02-07 20:23:42,8510242,"State College, PA",1,0,[]
830,@kcstreetcar Hello! Did you record this? Can we share this on our syndicated news coverage with credit to you?,1093605750700720128,2019-02-07 20:21:43,8510242,"State College, PA",1,0,[]
831,What a difference two weeks makes! Ice coverage on the The Great Lakes increased dramatically due to the… https://t.co/XP0OjHyhJ8,1093600287896621056,2019-02-07 20:00:01,8510242,"State College, PA",6,0,[]
832,"Temperatures are plummeting, but crime is on the rise: https://t.co/cUylWIPFGT",1093596508996288512,2019-02-07 19:45:00,8510242,"State College, PA",2,0,[]
833,"Witness the dramatic recovery of “Fluffy” the cat, who was found frozen in a Montana snowbank:… https://t.co/9oJKuGHSBV",1093592773431881728,2019-02-07 19:30:09,8510242,"State College, PA",3602,1074,[]
834,@wakcnews Wow! Did you record this? Can we share this on our syndicated news coverage with credit to you?,1093586313666838528,2019-02-07 19:04:29,8510242,"State College, PA",0,0,[]
835,"Sorry Seattle, it looks like the snow isn't done with you yet.
https://t.co/oHgyOKke72",1093585348121321472,2019-02-07 19:00:39,8510242,"State College, PA",9,5,[]
836,"Winds stronger than 40 mph? That's right!
Read more here:
https://t.co/2Xe7zOKbPQ",1093581423322320904,2019-02-07 18:45:03,8510242,"State College, PA",4,4,[]
837,@mgnelsonwrites Wow! We hope you're staying warm and safe. Did you record this video today? Can we share it on our… https://t.co/8Tg2EEtv4E,1093579767440461825,2019-02-07 18:38:28,8510242,"State College, PA",1,0,[]
838,"@juliebechtold Julie, we hope you're safe! Did you record this? Can we share it on our syndicated news coverage with credit to you?",1093579378288721920,2019-02-07 18:36:56,8510242,"State College, PA",0,0,[]
839,"@natemoll Hi Nate, nice video! Did you record this today? Where exactly is this? Can we share this on our syndicate… https://t.co/GULkpHe0sv",1093578854759874560,2019-02-07 18:34:51,8510242,"State College, PA",1,0,[]
840,"@GypsySt0rm Hello there, nice video. We hope you're staying dry! Did you record this and can we share it on our syn… https://t.co/pVyM8bnKtq",1093578427209338881,2019-02-07 18:33:09,8510242,"State College, PA",1,0,[]
841,"@mikevivy Hi Michael, doesn't look like a good day on campus! Can we share your two videos on our syndicated news c… https://t.co/PqBo6Wis8d",1093578272514981888,2019-02-07 18:32:32,8510242,"State College, PA",0,0,[]
842,"@BuffyJarrod Jarrod, did you record this video today? Where exactly is this? Can we share this on our syndicated ne… https://t.co/H0q5bsPAwf",1093578133012467713,2019-02-07 18:31:59,8510242,"State College, PA",0,0,[]
843,"@Boothbyin21c Wow! Crazy video, did you record this today? Can we share this on our syndicated news coverage with credit to you?",1093577894234853376,2019-02-07 18:31:02,8510242,"State College, PA",0,0,[]
844,"Wow: Watch as this bus driving down an icy road loses control and overturns!
https://t.co/BFI6UGGU9S https://t.co/WTyG6uugrf",1093569793259720706,2019-02-07 17:58:50,8510242,"State College, PA",14,9,[]
845,RT @JustinMcKeeWx: Here's the Thursday afternoon edition of the @WWAY @accuweather 7 day forecast. Already broken a record high in Wilmingt…,1093568092276473857,2019-02-07 17:52:05,8510242,"State College, PA",0,2,[]
846,"Brace yourselves for round two! This dose of Arctic air will still pack a punch, cause some pain and create dangero… https://t.co/r68F9Rbx43",1093562612841934854,2019-02-07 17:30:18,8510242,"State College, PA",6,2,[]
847,"Thanks, Solly! Our individual forecasts make planning your day a breeze 😎 https://t.co/HS5Mm93HvB",1093559987480248320,2019-02-07 17:19:53,8510242,"State College, PA",3,0,[]
848,"RT @dtdchange: How Much Warmer Was Your City in 2018?
3,800 cities compiled by
AccuWeather.... how did yours shape up?
https://t.co/OrY6hJS…",1093559704335368192,2019-02-07 17:18:45,8510242,"State College, PA",0,13,[]
849,"Wow, talk about a #duststorm! This mesmerizing photo was taken after a dust storm hit Rochester, Victoria Australia… https://t.co/XDtuIYZIeA",1093556152384831489,2019-02-07 17:04:38,8510242,"State College, PA",21,11,[duststorm]
850,"Despite what Phil said on Saturday, #Spring is still awhile away for a lot of regions in the United States. Get you… https://t.co/PIYCvI4BgG",1093554993171447808,2019-02-07 17:00:02,8510242,"State College, PA",4,3,[Spring]
851,"Some parts of California have seen more rain and snow already than all of last year combined. 

https://t.co/kMjzsdCVmg",1093547436998459393,2019-02-07 16:30:00,8510242,"State College, PA",6,4,[]
852,The ice jam in one small town has residents bringing their kids out to see the spectacle. They told @jpetramala tha… https://t.co/dkdHoB63zI,1093543660501852161,2019-02-07 16:15:00,8510242,"State College, PA",3,3,[]
853,@ojusstalwar Thanks!,1093540699176386561,2019-02-07 16:03:14,8510242,"State College, PA",1,0,[]
854,"Snow doesn't bother this bald eagle as he is perched calmly on a tree in Washington state. 

https://t.co/mPhtFKdvzx",1093539890296279040,2019-02-07 16:00:01,8510242,"State College, PA",9,2,[]
855,This cat undergoes a dramatic recovery you'll have to see to believe: https://t.co/fwkS631S5n https://t.co/vtnyX4tUSY,1093537692007231488,2019-02-07 15:51:17,8510242,"State College, PA",6,3,[]
856,"@suddenimpactout Hi Marc, we hope you're safe. Did you record this video today? Can we share it on our syndicated n… https://t.co/RxYrmlP8Zg",1093529866614566924,2019-02-07 15:20:11,8510242,"State College, PA",1,0,[]
857,@prasadneha Thanks!,1093529140484018176,2019-02-07 15:17:18,8510242,"State College, PA",0,0,[]
858,"@JoeShekleton Hi Joe, great videos we see you tagged our other account in your first video. Are we good to share bo… https://t.co/Q04gqzzxM5",1093528146769522688,2019-02-07 15:13:21,8510242,"State College, PA",1,0,[]
859,"@carolbauer320 Hi Carol, we hope you're safe. Did you record this video today? Can we share this on our syndicated… https://t.co/Vm1cXcW8mV",1093527922491699200,2019-02-07 15:12:28,8510242,"State College, PA",0,0,[]
860,"@MrrMukherjee Great pics. Did you take them? If so, may we use it in our syndicated coverage with credit to you?",1093527282164121601,2019-02-07 15:09:55,8510242,"State College, PA",1,0,[]
861,"@AnnuKaushik253 Great pic. Did you take it? If so, may we use it in our syndicated coverage with credit to you?",1093527004463403008,2019-02-07 15:08:49,8510242,"State College, PA",0,0,[]
862,"@iam_zubairali Great pic. Did you take it? If so, may we use it in our syndicated coverage with credit to you?",1093526812418805760,2019-02-07 15:08:03,8510242,"State College, PA",0,0,[]
863,"@prasadneha Great pic. Did you take it? If so, may we use it in our syndicated coverage with credit to you?",1093526721561796609,2019-02-07 15:07:41,8510242,"State College, PA",0,0,[]
864,"@ojusstalwar Great pic. Did you take it? If so, may we use it in our syndicated coverage with credit to you?",1093525914766532609,2019-02-07 15:04:29,8510242,"State College, PA",0,0,[]
865,"@lakra_anuradha @ParveenKaswan @Urmila92531581 @LeoDiCaprio Great pic. Did you take it? If so, may we use it in our… https://t.co/07ooqRy2JD",1093525821514567680,2019-02-07 15:04:07,8510242,"State College, PA",2,0,[]
866,"@TCDev Great pic. Did you take it? If so, may we use it in our syndicated coverage with credit to you?",1093525325588381696,2019-02-07 15:02:08,8510242,"State College, PA",1,0,[]
867,"An ice jam forced residents from their homes in Portland, Michigan Wednesday. @jpetramala reports:  https://t.co/PftrT5LPJ5",1093524786980868096,2019-02-07 15:00:00,8510242,"State College, PA",3,4,[]
868,RT @Brittany_Boyer: An impressive wet season so far in California... and guess what there's more snow on the way! https://t.co/IesucdaIok,1093520430105800707,2019-02-07 14:42:41,8510242,"State College, PA",0,2,[]
869,This officer has a PSA for car owners that live in colder climates: https://t.co/Q9j4oQH5KB,1093517301230567427,2019-02-07 14:30:15,8510242,"State College, PA",2,1,[]
870,"This map shows when regions will start to ""feel like"" spring compared to an average spring day. What does this spri… https://t.co/WcK0CZSQ63",1093509689046953985,2019-02-07 14:00:00,8510242,"State College, PA",10,11,[]
871,December 2018’s combined global land and ocean average surface temperature was the second warmest December in the 1… https://t.co/PYNTKbmrQo,1093479488204107776,2019-02-07 12:00:00,8510242,"State College, PA",4,2,[]
872,"Gone are the days of the lazy snow day. Some school districts are now making snow days online learning days.

https://t.co/6TvzngbyU7",1093464390731325440,2019-02-07 11:00:00,8510242,"State College, PA",9,4,[]
873,"Bald eagle perches calmly atop a tree during snowstorm. 
https://t.co/mPhtFKdvzx https://t.co/zZNtqag8lT",1093434190077411329,2019-02-07 09:00:00,8510242,"State College, PA",75,22,[]
874,"At least 10 people were killed in avalanches across the Alps earlier this week as avalanche risk continues to loom:
https://t.co/GyGDYGpTHD",1093419213404942336,2019-02-07 08:00:29,8510242,"State College, PA",2,1,[]
875,Police officer takes high-speed race to a whole new level. https://t.co/xWUBU1KDUH,1093373799716802560,2019-02-07 05:00:02,8510242,"State College, PA",138,28,[]
876,"Boeing is on track to launch its new astronaut taxi to the International Space Station (ISS) next month.
https://t.co/WAKXnT8YKT",1093358725400879109,2019-02-07 04:00:08,8510242,"State College, PA",5,1,[]
877,The AccuWeather 2019 Spring Forecast is here! How does the forecast look for your region? https://t.co/Qhnfi6Qn6c,1093343593954242560,2019-02-07 03:00:00,8510242,"State College, PA",8,2,[]
878,"Thanks in part to the #polarvortex, the ice on the Great Lakes have reached levels not seen since 2014.… https://t.co/g4ZiRVq7IG",1093336042667720705,2019-02-07 02:30:00,8510242,"State College, PA",6,3,[polarvortex]
879,The unseasonably warm weather on the East Coast that started on Sunday had areas greatly affected by the… https://t.co/Y5RWivfW3d,1093328582238236672,2019-02-07 02:00:21,8510242,"State College, PA",4,0,[]
880,"RT @TravisABC13: A force field of Spring warmth is still protecting Texas from Winter's return, but it won't last...

Two cold fronts arriv…",1093317109801725952,2019-02-07 01:14:46,8510242,"State College, PA",0,13,[]
881,Seattle rarely sees snow like this: https://t.co/raC1IKd1wv,1093313439320195072,2019-02-07 01:00:11,8510242,"State College, PA",45,14,[]
882,"The Earth experienced its fourth hottest year on the 139-year record! #ClimateChange

https://t.co/YWfQzBGuqk https://t.co/EMmlU35Vl6",1093305843406290944,2019-02-07 00:30:00,8510242,"State College, PA",11,3,[ClimateChange]
883,RT @stacyanngooden: Celebrating Black History Month: How Evelyn Fields became a pioneer in science and the military #blackhistorymonth http…,1093304771283509250,2019-02-07 00:25:44,8510242,"State College, PA",0,18,[blackhistorymonth]
884,Retired Rear Admiral Evelyn Fields was the first woman and first African-American director of @NOAA Office of Marin… https://t.co/98QNMuzihh,1093298401146482688,2019-02-07 00:00:25,8510242,"State College, PA",12,3,[]
885,"WOW: This dog fell in the icy Whitefish River in Montana, luckily firefighters helped to rescue and return him home… https://t.co/ncXHRa66yJ",1093283352210259974,2019-02-06 23:00:38,8510242,"State College, PA",41,8,[]
886,"The World Magnetic Model was last updated in 2015 and expected to last until 2020, but the magnetic north pole had… https://t.co/HzJXsVpAym",1093275668354338817,2019-02-06 22:30:06,8510242,"State College, PA",13,7,[]
887,The longest government shutdown in United States history took a toll on the country’s national parks in more ways t… https://t.co/nBBRyjqZXs,1093268098424205312,2019-02-06 22:00:01,8510242,"State College, PA",6,1,[]
888,"This bald eagle, in Washington state, isn't afraid of a little snow. https://t.co/wnIOR3lZ7Z",1093260581191274496,2019-02-06 21:30:09,8510242,"State College, PA",112,31,[]
889,We are proud to announce the promotion of John Dokes to Chief Content Officer and President of the growing AccuWeat… https://t.co/fmzBYnJvpu,1093253190030688269,2019-02-06 21:00:46,8510242,"State College, PA",10,2,[]
890,RT @WGNWeatherGuy: Rapid freezing of Great Lakes during record cold snap signals weather impacts for the rest of winter https://t.co/OWmBLh…,1093251619007987717,2019-02-06 20:54:32,8510242,"State College, PA",0,4,[]
891,Check out this neat @nytimes data visualization using our data. It tells you how much warmer than normal your city… https://t.co/tOa6WTk4XF,1093246716873240584,2019-02-06 20:35:03,8510242,"State College, PA",5,1,[]
892,"Calm waters, a sunset and dolphins? What more could you want?
https://t.co/sxDSOjnFk0",1093245490341261312,2019-02-06 20:30:11,8510242,"State College, PA",11,0,[]
893,@IAStormChasing Nice video! Did you record this? Are we able to share this on our syndicated news coverage with credit to you?,1093244192686510080,2019-02-06 20:25:01,8510242,"State College, PA",0,0,[]
