,tweet,id,time,user,location,favourites,retweet-count,hashtags
2424,"A powerful #lightningstrike with three branches emerged from a thunderstorm over Tehran, Iran on Sept. 23. (Photo G… https://t.co/PdmBmnwZpN",1049690827075833857,2018-10-09 15:59:30,8510242,"State College, PA",31,11,[lightningstrike]
2425,@shrillmama Thank you.,1049685842401333248,2018-10-09 15:39:41,8510242,"State College, PA",0,0,[]
2426,"@boodie7sports Wow! Hope everyone is okay. Did you take this photo? If so, may we use this photo for our syndicated… https://t.co/gDReUuPrxV",1049685494102134784,2018-10-09 15:38:18,8510242,"State College, PA",0,0,[]
2427,"@groom_tyler35 Wow! Hope everyone is safe. Did you take this photo? If so, may we use it for our syndicated news co… https://t.co/f6NpIeCfeH",1049683607659405313,2018-10-09 15:30:48,8510242,"State College, PA",0,0,[]
2428,"@shrillmama Wow! Hope everyone is safe. Did you take these photos? If so, may we use them for our syndicated news c… https://t.co/DmJ3tWKSfu",1049682589542469632,2018-10-09 15:26:46,8510242,"State College, PA",0,0,[]
2429,@HaydenLewis35 Wow! Hope everyone is okay! Where did you take this photo? May we use it for our syndicated news coverage with credit to you?,1049681275911634944,2018-10-09 15:21:32,8510242,"State College, PA",0,0,[]
2430,@wx4tcc Wow! Hope everyone is okay. Where did you take this photo? May we use it for our syndicated news coverage with credit to you?,1049681030511235072,2018-10-09 15:20:34,8510242,"State College, PA",1,0,[]
2431,"@joanncorley Hi JoAnn, thank you for pointing that out. We will be resolving those map errors shortly!",1049675714704879616,2018-10-09 14:59:27,8510242,"State College, PA",1,0,[]
2432,"Streets were already flooding on Monday afternoon in Dauphin Island, Alabama as #HurricaneMichael added to unusuall… https://t.co/VRVwRS5Ybn",1049663534722891776,2018-10-09 14:11:03,8510242,"State College, PA",26,16,[HurricaneMichael]
2433,@ropp_christina Hello! Can we share your video on our syndicated news coverage with credit to you?,1049663015803658240,2018-10-09 14:08:59,8510242,"State College, PA",1,0,[]
2434,"@percigator Hi Blake, can we share your video on our syndicated news coverage with credit to you?",1049662348422721537,2018-10-09 14:06:20,8510242,"State College, PA",0,0,[]
2435,Is it just us or does the center of Hurricane #Michael look like a SKULL? Meteorologist @WxDickey pointed this out.… https://t.co/fnvS476ubB,1049656221354078209,2018-10-09 13:41:59,8510242,"State College, PA",181,85,[Michael]
2436,"@bricebarnes Hi Brice, can we share this video on our syndicated news coverage with credit to you?",1049422219691069440,2018-10-08 22:12:09,8510242,"State College, PA",0,0,[]
2437,@Josh_Breanna Hi Josh can we share your video on our syndicated news coverage with credit to you?,1049413843359858689,2018-10-08 21:38:52,8510242,"State College, PA",0,0,[]
2438,"The town of Fairfax, Oklahoma is without power and is dealing with damage after a #tornado touched down on Sunday. https://t.co/FZEV93lKTw",1049382776548589568,2018-10-08 19:35:25,8510242,"State College, PA",75,47,[tornado]
2439,"RT @forecasterchall: FYI: Trading will be halted TODAY at 4:00 PM ET for Hurricane Michael. The time is now, go make a prediction at https:…",1049375017107116033,2018-10-08 19:04:35,8510242,"State College, PA",0,2,[]
2440,"This satellite image provided by the @NOAA on Sunday, Oct. 7 at 6:52PM EST shows a view of #TropicalStorm Michael,… https://t.co/WwHffJJYUW",1049359961866883073,2018-10-08 18:04:45,8510242,"State College, PA",9,5,[TropicalStorm]
2441,We are #facebooklive with a Hurricane #Michael update from @AccuRayno https://t.co/4q4NzpOZ28 https://t.co/etKG07MM9v,1049333989977329664,2018-10-08 16:21:33,8510242,"State College, PA",15,3,"[facebooklive, Michael]"
2442,"While @ReedTimmerAccu was chasing a possible tornado threat in Melrose, New Mexico Sunday, a double rainbow formed… https://t.co/q8wdoanSJr",1049313710299385857,2018-10-08 15:00:58,8510242,"State College, PA",195,27,[]
2443,@Nothoshii Hello! Where is this video from and can we share it on our syndicated news coverage with credit to you?,1049308127475236865,2018-10-08 14:38:47,8510242,"State College, PA",0,0,[]
2444,"@successwithkl Hi Kevin, great video. Can we share your video on our syndicated news coverage with credit to you?",1049271010493706240,2018-10-08 12:11:18,8510242,"State College, PA",1,0,[]
2445,"@lakambinie Hi Aira, where did you record this video? Can we have your permission to share it on our syndicated news coverage?",1049270345419710464,2018-10-08 12:08:39,8510242,"State College, PA",0,0,[]
2446,How do engineers construct bridges to withstand hurricanes and earthquakes? https://t.co/jwgkKYdpkb,1049063090678063109,2018-10-07 22:25:06,8510242,"State College, PA",23,1,[]
2447,"14 tornadoes struck Pennsylvania last Tuesday. 

This photo was taken by the NWS in Buttonwood, PA. Share your weat… https://t.co/g1dAk6M122",1048997653491699714,2018-10-07 18:05:04,8510242,"State College, PA",13,5,[]
2448,Get this year’s long range #winter forecast and the impact of unpredictable weather on the MLB post season. Listen… https://t.co/bBQzOICRZY,1048649283954794496,2018-10-06 19:00:46,8510242,"State College, PA",6,4,[winter]
2449,"Gorgeous #fallfoliage in Guilford, Maine taken on October . (Instagram/ @che_che_oyvey) 

Use #AccuPhoto to share y… https://t.co/U6PH7lwOdd",1048619063180759040,2018-10-06 17:00:41,8510242,"State College, PA",46,9,"[fallfoliage, AccuPhoto]"
2450,Long-range Meteorologist Paul Pastelok explains this year’s winter forecast before discussing the unpredictable wea… https://t.co/5ziQj1u9ta,1048588864271646720,2018-10-06 15:00:41,8510242,"State College, PA",4,0,[]
2451,"@charnick_wx Hi  Michael, can we share your video on our syndicated news coverage with credit to  you?",1048299072929636352,2018-10-05 19:49:10,8510242,"State College, PA",0,0,[]
2452,"As humans, risks, including earthquakes and hurricanes, are a part of our relationship with the planet and its proc… https://t.co/MqwiaSb1sR",1048294315787792384,2018-10-05 19:30:15,8510242,"State College, PA",7,2,[]
2453,@jratcliff Great video! Can we share this on our syndicated news coverage with credit to you?,1048287105003216896,2018-10-05 19:01:36,8510242,"State College, PA",0,0,[]
2454,Koh Samui Island in Thailand was woken up to an eerie sunrise #storm forming overhead on October 4. Look at those c… https://t.co/2svMIs2nk6,1048286872466804736,2018-10-05 19:00:41,8510242,"State College, PA",36,11,[storm]
2455,#ICYMI Indonesia continues to deal with the aftermath of a tragic earthquake and following tsunami that killed more… https://t.co/qw3EaIsiUc,1048239217116102657,2018-10-05 15:51:19,8510242,"State College, PA",4,2,[ICYMI]
2456,@GiantsRidge Good morning! Can we share your video on our syndicated news coverage with credit to you? Stay warm up there!,1048218514312585219,2018-10-05 14:29:03,8510242,"State College, PA",1,0,[]
2457,@MTsteamboat She looks like she's having a great time! Where in Montana is this?,1048216746405101570,2018-10-05 14:22:01,8510242,"State College, PA",1,0,[]
2458,"@jennyhardmantv Hi Jennifer, great video! Can we share it on our syndicated news coverage with credit to you?",1048215907900825601,2018-10-05 14:18:42,8510242,"State College, PA",1,0,[]
2459,@Twylight9 Good morning! Can we share your video on our syndicated news coverage with credit to you? Please include… https://t.co/hG5pjvvfyt,1048215573384110081,2018-10-05 14:17:22,8510242,"State College, PA",1,0,[]
2460,@MTsteamboat Hello! Is this video from today? Can we have your permission to share it on our syndicated news covera… https://t.co/Tdjgyqd4VA,1048215147771285505,2018-10-05 14:15:40,8510242,"State College, PA",1,0,[]
2461,"@thekbaldwin Hi Kerry, can we share your video on our syndicated news coverage with credit to you? What part of North Dakota is this from?",1048214358256484352,2018-10-05 14:12:32,8510242,"State College, PA",1,0,[]
2462,RT @RMetS: The public vote for our Weather Photographer of the Year 2018 is now open! Our judges have shortlisted 30 amazing images out of…,1048180928483414017,2018-10-05 11:59:42,8510242,"State College, PA",0,3,[]
2463,"@irishbob88 Hi Bob, can we share your video on our syndicated news coverage with credit to you?",1047964764222185472,2018-10-04 21:40:44,8510242,"State College, PA",1,0,[]
2464,"#Tsunamis are difficult to detect and predict, but here are some ways that you can still protect yourself!… https://t.co/nZV8Zhoc7T",1047931988634718208,2018-10-04 19:30:30,8510242,"State College, PA",9,3,[Tsunamis]
2465,"Un-be-leaf-able fall foliage footage via drone in Utah this week! 
https://t.co/RdyHp7HO66",1047909353397932034,2018-10-04 18:00:33,8510242,"State College, PA",20,7,[]
2466,"Flooding from #Hurricane Florence in North Carolina has left big, aggressive mosquitos behind: https://t.co/e57EsPffAo",1047894226963509249,2018-10-04 17:00:27,8510242,"State College, PA",89,43,[Hurricane]
2467,"As #fall progresses, the leaves begin to change color and air begins to cool. Hence, in the evening of Oct. 3, fog… https://t.co/G4maDURxXk",1047879279063834637,2018-10-04 16:01:03,8510242,"State College, PA",21,3,[fall]
2468,"@ZiggysTweeting @NWSGreenBay Hi Ziggy, can we share your video on our syndicated news coverage with credit to you?",1047855007750602752,2018-10-04 14:24:36,8510242,"State College, PA",0,0,[]
2469,"@Little_Debs Hi Debbie, can we share your video on our syndicated news coverage? We will provide credit to you.",1047819957801771008,2018-10-04 12:05:20,8510242,"State College, PA",1,0,[]
2470,"@MarkJWestpfahl Hi Mark, can we share your video on our syndicated news coverage with credit to you?",1047818831647965184,2018-10-04 12:00:51,8510242,"State College, PA",1,0,[]
2471,Wow! Watch this Manhattan building become illuminated by a nearby #lightning strike! https://t.co/UV6v8Yk9NG,1047592194381627398,2018-10-03 21:00:17,8510242,"State College, PA",30,8,[lightning]
2472,What is a 'medicane'? Listen to the AccuWeather Daily podcast on your Google Assistant-enabled device or on iTunes… https://t.co/2FIMKye0da,1047562146840817664,2018-10-03 19:00:53,8510242,"State College, PA",5,0,[]
2473,"Oh the #weather outside is frightful... so to make it pleasant, a snowplow helped clear roads near St. Mary, Montan… https://t.co/NaLIga9ATO",1047546911878799360,2018-10-03 18:00:20,8510242,"State College, PA",23,9,[weather]
2474,"@rbnphoto Hi Brad, can we share your video on our syndicated news coverage? Let us know and please include a locati… https://t.co/JtnK8S9HDu",1047544897560035330,2018-10-03 17:52:20,8510242,"State College, PA",0,0,[]
2475,"@LobotC2DFW Hi Brent, you likely encountered an ad in the AccuWeather app with video embedded, which may cause an i… https://t.co/6cjVlYtI98",1047535827100860416,2018-10-03 17:16:18,8510242,"State College, PA",0,0,[]
2476,Flooding from former Tropical Storm Rosa trapped cars in Phoenix Tuesday. https://t.co/DcdbFQqe8N,1047481192092721152,2018-10-03 13:39:12,8510242,"State College, PA",22,15,[]
2477,@StevensPass Good morning! Can we share your video on our syndicated news coverage?,1047462746567188480,2018-10-03 12:25:54,8510242,"State College, PA",0,0,[]
2478,"Don’t forget, this is today, Wednesday October 3rd. https://t.co/JU9Ckr0g9L",1047456327264612358,2018-10-03 12:00:23,8510242,"State College, PA",9,7,[]
2479,Both cold and hot weather can reduce your cell phone battery's life and cause it to take longer to charge.… https://t.co/hVHvMc4VsE,1047243671576436737,2018-10-02 21:55:22,8510242,"State College, PA",9,4,[]
2480,#AccuWeatherReady alert: Autumn leaves falling on the ground can be beautiful – but hazardous to drivers and bikers… https://t.co/j1XafyZgiX,1047229799612207104,2018-10-02 21:00:15,8510242,"State College, PA",10,2,[AccuWeatherReady]
2481,"Initial estimates to crop damage and livestock from Hurricane Florence are expected to be over $1,100,000,000 ($1.1… https://t.co/GtaQebDRZp",1047205848299331585,2018-10-02 19:25:05,8510242,"State College, PA",6,9,[]
2482,"@Sandrakotz Hi Sandra, crazy video! Can we share it on our syndicated news coverage with credit to you? Stay safe out there.",1047193410698981376,2018-10-02 18:35:39,8510242,"State College, PA",0,0,[]
2483,"@Johartz Hi Josh, where did you record this video? And can we share it on our syndicated news coverage with credit to you? Stay safe!",1047192426656485376,2018-10-02 18:31:45,8510242,"State College, PA",0,0,[]
2484,Hurricane Florence has caused billions of mosquitoes -- some which are quite large and can bite through clothes --… https://t.co/CrnnBuYgEY,1047190742395961344,2018-10-02 18:25:03,8510242,"State College, PA",10,7,[]
2485,@NicsRemarks @ReedTimmerAccu @breakingweather Thanks for sharing your video! Are we okay to share it on our syndica… https://t.co/7LXqheNWaB,1047187401972568067,2018-10-02 18:11:47,8510242,"State College, PA",0,0,[]
2486,"Five years ago Wednesday, ❄️58❄️ inches of snow fell near Rapid City, South Dakota!

It was known as ""The Cattlemen… https://t.co/yFBA4KxDe0",1047160547781828609,2018-10-02 16:25:04,8510242,"State College, PA",19,8,[]
2487,"Those in #Calgary, Alberta, Canada are already experiencing a ""winter wonderland"" on October 2. Are you ready for s… https://t.co/5hVb7CildO",1047154472928075777,2018-10-02 16:00:56,8510242,"State College, PA",59,32,[Calgary]
2488,@HeySeto Thank you.,1047142041359134723,2018-10-02 15:11:32,8510242,"State College, PA",0,0,[]
2489,@S_Pierpoint Thank you.,1047141681823457280,2018-10-02 15:10:06,8510242,"State College, PA",0,0,[]
2490,"@S_Pierpoint Wow! Did you take these photos? If so, may we use them for our syndicated news coverage with credit to you?",1047139077399728128,2018-10-02 14:59:45,8510242,"State College, PA",0,0,[]
2491,"@HeySeto Wow! Did you take this photo? If so, may we use it for our syndicated news coverage with credit to you?",1047138806116364288,2018-10-02 14:58:40,8510242,"State College, PA",0,0,[]
2492,@Jonleescholes Thank you.,1047135893990137856,2018-10-02 14:47:06,8510242,"State College, PA",1,0,[]
2493,@brewingrealty Thank you.,1047134416043216896,2018-10-02 14:41:14,8510242,"State College, PA",1,0,[]
2494,@poisondelight Thank you.,1047134366927863809,2018-10-02 14:41:02,8510242,"State College, PA",0,0,[]
2495,@SJ_Ketcheson Thank you!,1047133132917563392,2018-10-02 14:36:08,8510242,"State College, PA",0,0,[]
2496,"@brewingrealty Wow! Did you take this photo? If so, may we use it for our syndicated news coverage with credit to you?",1047132861273427969,2018-10-02 14:35:03,8510242,"State College, PA",2,0,[]
2497,"@BadlandsBoyse Wow! Did you take this picture? If so, may we use it for our syndicated news coverage with credit to you?",1047130851903987712,2018-10-02 14:27:04,8510242,"State College, PA",1,0,[]
2498,"@Jonleescholes Wow! Did you take these pictures? If so, may we use them for our syndicated news coverage with credit to you?",1047130503076335616,2018-10-02 14:25:41,8510242,"State College, PA",0,0,[]
2499,@poisondelight Wow! Did you take this picture? May we use it for our syndicated news coverage with credit to you?,1047130261178191872,2018-10-02 14:24:43,8510242,"State College, PA",0,0,[]
2500,@Mookalicious Wow! Did you take this picture? May we use it for our syndicated news coverage with credit to you?,1047129956122288128,2018-10-02 14:23:30,8510242,"State College, PA",2,0,[]
2501,@ChantalRytz Wow! Did you take this picture? May we use it for our syndicated news coverage with credit to you?,1047129873612005376,2018-10-02 14:23:11,8510242,"State College, PA",0,0,[]
2502,@Azueme Thank you!,1047129507134672897,2018-10-02 14:21:43,8510242,"State College, PA",0,0,[]
2503,"@SJ_Ketcheson Wow, great photo! Did you take this? If so, may AccuWeather use your photo for our syndicated news coverage?",1047128210595569666,2018-10-02 14:16:34,8510242,"State College, PA",0,0,[]
2504,"@Azueme Wow, great photo! Did you take this? If so, may we use this for our syndicated news coverage with credit to you?",1047127507001139200,2018-10-02 14:13:47,8510242,"State College, PA",1,0,[]
2505,"@cgionet_WIC Wow, great photo! Did you take this? If so, may we use this for our syndicated news coverage with credit to you?",1047126685731176448,2018-10-02 14:10:31,8510242,"State College, PA",0,0,[]
2506,"SCARY: Donggala, Indonesia last Friday. They see the #tsunami coming, jump off their boats, and run for their lives. https://t.co/cPfslHwlj2",1047116685457674240,2018-10-02 13:30:46,8510242,"State College, PA",18,14,[tsunami]
2507,@DigitalGlobe Hello there! May AccuWeather use these images with credit to you? What is the licensing process for a… https://t.co/sae5ZeVZsV,1047112978619949056,2018-10-02 13:16:03,8510242,"State College, PA",1,0,[]
2508,"What's a ""Polar Low""? https://t.co/Okfw2Kdl1t",1046927817974456321,2018-10-02 01:00:17,8510242,"State College, PA",49,15,[]
2509,@oliviapxo Thank you.,1046878603080867841,2018-10-01 21:44:43,8510242,"State College, PA",1,0,[]
2510,"@oliviapxo Wow, where did you take these pictures? May we use them for our syndicated news coverage with credit to you?",1046877192515457025,2018-10-01 21:39:07,8510242,"State College, PA",1,0,[]
2511,"A spectacular lightning show from #TropicalStorm Rosa in La Quinta, California last night: https://t.co/3npXBIMa9j",1046867450493636610,2018-10-01 21:00:24,8510242,"State College, PA",20,6,[TropicalStorm]
2512,"On Sept. 30, incredible lenticular wave #clouds and a sunset were spotted simultaneously over Southern California.… https://t.co/Gd5pHRX5hu",1046837231632220165,2018-10-01 19:00:19,8510242,"State College, PA",242,64,[clouds]
2513,@BarefootFC Correction: Today.,1046828246803918851,2018-10-01 18:24:37,8510242,"State College, PA",0,0,[]
2514,@BarefootFC We'll tweet it from @accuweather tomorrow,1046827925025304576,2018-10-01 18:23:21,8510242,"State College, PA",0,0,[]
2515,"The weather can affect fall foliage in many ways, including rain and temperatures months before the colors appear. https://t.co/dTWJ7XKE3a",1046823054586912768,2018-10-01 18:03:59,8510242,"State College, PA",13,3,[]
2516,@BarefootFC Great pic!! We were wondering if we could use it as our #accuphoto of the day?,1046812843088252934,2018-10-01 17:23:25,8510242,"State College, PA",1,0,[accuphoto]
2517,"@APS_AnnaC Hi Anna, great video as everyone else has mentioned. Can we share it on our syndicated news coverage with credit to you?",1046806963689074688,2018-10-01 17:00:03,8510242,"State College, PA",2,0,[]
2518,There's a test of FEMA's 'Presidential Alert' emergency alert system test on Wednesday: https://t.co/0LfZl9DZNS Sta… https://t.co/MlU2RQH1Sb,1046805709915140096,2018-10-01 16:55:04,8510242,"State College, PA",6,6,[]
2519,Recent #shark attacks have raised questions about shark migration patterns and changing ocean temperatures.  We exp… https://t.co/GJm1X9pdoD,1046803205684953090,2018-10-01 16:45:07,8510242,"State College, PA",4,0,[shark]
2520,"Shocking footage: The moment the #tsunami hit Palu, Indonesia last week https://t.co/3Ej76XCdqb",1046788835634548736,2018-10-01 15:48:01,8510242,"State College, PA",15,4,[tsunami]
2521,"Even though the sun came back, the cruelty of Hurricane Florence was just starting to sink in. @jpetramala reports… https://t.co/4pJu4U9Yxl",1046776255763365888,2018-10-01 14:58:02,8510242,"State College, PA",10,13,[]
2522,"@Fivepac Peter, great video! Can we share it on our syndicated news coverage with credit to you?",1046735150040649728,2018-10-01 12:14:41,8510242,"State College, PA",1,0,[]
2523,"@crazymet_yeg Hi Michael, great video! Can we share it on our syndicated news coverage with credit to you?",1046733744109948930,2018-10-01 12:09:06,8510242,"State College, PA",1,0,[]
2524,"@pitpenguins87 HI Matthew, can we share your great video on our syndicated news coverage with credit to you? Let us know!",1046733335056265221,2018-10-01 12:07:29,8510242,"State College, PA",1,0,[]
2525,"@oliviappeterson Hi Olivia, would we be able to share your video on our syndicated news coverage with credit to you? Let us know!",1046733166277529601,2018-10-01 12:06:48,8510242,"State College, PA",1,0,[]
2526,Winds howl through Okinawa during #Typhoon Trami on September 29: https://t.co/fFyo669nNe,1046505130139545601,2018-09-30 21:00:40,8510242,"State College, PA",44,13,[Typhoon]
2527,"#ICYMI: The Carolinas continue to deal with life-threatening flooding from #Florence, deadly rain pummeled parts of… https://t.co/k0tSy8KmxK",1046474866222944258,2018-09-30 19:00:25,8510242,"State College, PA",6,1,"[ICYMI, Florence]"
2528,"A stunning shot of a #shelfcloud taken on July 23, 2010 East of Ghedi, Lombardia, Italy. (Instagram/ @ale.piazza_st… https://t.co/HgnenY2N1R",1046429633237921792,2018-09-30 16:00:40,8510242,"State College, PA",68,14,[shelfcloud]
2529,Host @ReginaMillerWX speaks with @ReedTimmerAccu and @jpetramala about #HurricaneFlorence on this week's episode of… https://t.co/cOaMh5qqxi,1046119962484625409,2018-09-29 19:30:09,8510242,"State College, PA",19,6,[HurricaneFlorence]
2530,Happy #NationalCoffeeDay! Could climate change pose a threat to the future of this beloved beverage? https://t.co/2CMfHRFRz0,1046102156376510464,2018-09-29 18:19:24,8510242,"State College, PA",20,8,[NationalCoffeeDay]
2531,"A beautiful #sunset in Brighton, Canada taken on June 30. (AccuFan/ '1 Shutterbug1) 

Use #AccuPhoto to share your… https://t.co/PqYRLDaJaM",1046082263547617280,2018-09-29 17:00:21,8510242,"State College, PA",22,2,"[sunset, AccuPhoto]"
2532,@terryfinisterre We will be sure to credit your twitter handle. How are things today on the island?,1045769597125894145,2018-09-28 20:17:56,8510242,"State College, PA",0,0,[]
2533,"@terryfinisterre Hi Terry, May we show your videos from Thursday on our syndicated news coverage with credit to you? Stay safe.",1045768618783526914,2018-09-28 20:14:02,8510242,"State College, PA",0,0,[]
2534,"@terryfinisterre Hi Terry, We hope you and your family are safe! Did you record this video, can we share it on our… https://t.co/pRCmBpnfHk",1045768443482570753,2018-09-28 20:13:21,8510242,"State College, PA",0,0,[]
2535,"Find out the differences between a ""Medicane"" and a hurricane. https://t.co/NBk1GPtwDS",1045765151792812034,2018-09-28 20:00:16,8510242,"State College, PA",26,10,[]
2536,"Even after the water recedes, there are long-term health dangers floods pose to affected communities. Listen to the… https://t.co/Y7gxzjFaVc",1045750165653651456,2018-09-28 19:00:43,8510242,"State College, PA",4,2,[]
2537,@ConnorBlades Thank you!,1045746004509831169,2018-09-28 18:44:11,8510242,"State College, PA",0,0,[]
2538,@ConnorBlades Thank you. Where exactly was this taken and how much rain do you think you've had?,1045744304323481605,2018-09-28 18:37:25,8510242,"State College, PA",0,0,[]
2539,"@ConnorBlades Hello, did you record this video? Can we share it on our syndicated news coverage with credit to you?",1045743268590489600,2018-09-28 18:33:18,8510242,"State College, PA",0,0,[]
2540,@myBemidji Hello! Can we share your video on our syndicated news coverage with credit to you? Stay warm!,1045740233181077504,2018-09-28 18:21:15,8510242,"State College, PA",0,0,[]
2541,"via @jpetramala:  Water levels were a major concern as severe #flooding peaked in #Socastee, #SouthCarolina last ni… https://t.co/kMj1nztMXF",1045735008248508416,2018-09-28 18:00:29,8510242,"State College, PA",6,2,"[flooding, Socastee, SouthCarolina]"
2542,"RT @PennStateFball: 🚨 ATTENTION FANS 🚨 

A Special Weather Statement for the #OSUvsPSU matchup, brought to you by our very own @Truk_Savage…",1045679233966780417,2018-09-28 14:18:51,8510242,"State College, PA",0,461,[OSUvsPSU]
2543,This week @ReedTimmerAccu and @jpetramala go above and beyond their normal call of duty and tell us about their fir… https://t.co/Uw0e6gt4vy,1045402801994706945,2018-09-27 20:00:25,8510242,"State College, PA",49,16,[]
2544,"RT @ReedTimmerAccu: Beautiful day in Clarksville, AR at the University of the Ozarks! Looking forward to showing you videos from inside tor…",1045384103791669250,2018-09-27 18:46:07,8510242,"State College, PA",0,17,[]
2545,"Stunning images of #TyphoonTrami, currently projected to make landfall in mainland Japan on Sunday, have been captu… https://t.co/vbec1m0PB6",1045363722598977536,2018-09-27 17:25:08,8510242,"State College, PA",48,23,[TyphoonTrami]
2546,"Fatal flooding struck Soddy-Daisy, Tennessee yesterday as record-setting rain pummeled the area: https://t.co/QPT25C5wtl",1045349977776697344,2018-09-27 16:30:31,8510242,"State College, PA",10,2,[]
2547,"Most people have observed lightning, but have you witnessed lightning and a rainbow in the #sky at the same moment?… https://t.co/IHTzotGM6K",1045342641074909189,2018-09-27 16:01:21,8510242,"State College, PA",49,13,[sky]
2548,"Just sitting on an asteroid, watching the sun rise and set… @AccuAstronomy https://t.co/sJdrLlA8m4",1045328307984760833,2018-09-27 15:04:24,8510242,"State College, PA",19,8,[]
2549,"@analisasorrells @EducationNC Hi Analisa, can we share your video on our syndicated news coverage with credit to you? -BB",1045285625786765312,2018-09-27 12:14:48,8510242,"State College, PA",0,0,[]
2550,"If you return home after a flood to find your cherished family photos soaked with water or mud, keep these tips in… https://t.co/dk0HQv3nLB",1045055586411454469,2018-09-26 21:00:42,8510242,"State College, PA",11,3,[]
2551,"@KileyThomasNC9 Hi Kiley, may we share your video on our syndicated news coverage with credit to you?",1045043578462965761,2018-09-26 20:12:59,8510242,"State College, PA",0,0,[]
