,tweet,id,time,user,location,favourites,retweet-count,hashtags
1611,Winter weather advisories (white) are in effect from New York to Maine as snow sweeps across the area through Monda… https://t.co/HnOasYr5XG,1074506997591101442,2018-12-17 03:30:06,19071682,"State College, PA",12,12,[]
1612,"Cold air diving into the northeastern United States to start the new week will be accompanied by gusty winds, snow… https://t.co/OqOGDV7b4W",1074488112376631296,2018-12-17 02:15:03,19071682,"State College, PA",17,15,[]
1613,Residents of northern Queensland endured a second and more severe strike by former-Tropical Cyclone Owen this weeke… https://t.co/eb0PnrVFTF,1074469266878066695,2018-12-17 01:00:10,19071682,"State College, PA",8,6,[]
1614,"Rain, wind, mountain snow and rough surf will lash the Northwest and California through Sunday night as the barrage… https://t.co/NNL5clkJQt",1074450364328566784,2018-12-16 23:45:03,19071682,"State College, PA",25,17,[]
1615,"As students embark on winter break, last-minute shoppers head to the stores and holiday travel ramps up across the… https://t.co/WOAvpDvAQ4",1074432371980681221,2018-12-16 22:33:34,19071682,"State College, PA",8,5,[]
1616,Large storms and cold air are likely to take a break over much of the nation during much of the week ahead of the C… https://t.co/ZOu0nxYW5g,1074413877062975488,2018-12-16 21:20:04,19071682,"State College, PA",21,14,[]
1617,"Cold air diving into the northeastern United States to start the new week will be accompanied by gusty winds, snow… https://t.co/YuLFLXunGg",1074396268754034689,2018-12-16 20:10:06,19071682,"State College, PA",25,20,[]
1618,Severe Cyclonic Storm Phethai in the Bay of Bengal is expected to move into eastern India early in the week bringin… https://t.co/5M1KPnzURL,1074379904765100032,2018-12-16 19:05:04,19071682,"State College, PA",10,4,[]
1619,Residents of northern Queensland are enduring a second and more severe strike by former-Tropical Cyclone Owen:… https://t.co/SGsR09hc18,1074363653338615808,2018-12-16 18:00:30,19071682,"State College, PA",8,4,[]
1620,"While one storms rolls through the northwestern U.S. today, Monday will feature a brief calm period before the next… https://t.co/kCH1KTTVSL",1074345930265108480,2018-12-16 16:50:04,19071682,"State College, PA",10,7,[]
1621,"Following heavy rainfall and snowmelt at the end of the week, river flooding will continue to be a concern in the s… https://t.co/tGWp9EW7at",1074328314645491712,2018-12-16 15:40:04,19071682,"State College, PA",6,7,[]
1622,"With Christmas just nine days away, many are wondering what the weather will be like for their holiday travel and w… https://t.co/xUvKHmmbXa",1074310703761293312,2018-12-16 14:30:06,19071682,"State College, PA",46,31,[]
1623,"While it is currently mild and rainy across much of the Northeast, a fresh wave of cold air and lake-effect snow wi… https://t.co/16lXI5EM8W",1074295608624713729,2018-12-16 13:30:07,19071682,"State College, PA",12,12,[]
1624,Strengthening Cyclonic Storm #Phethai will bring high winds and flooding rainfall to eastern #India into early week… https://t.co/ck4UahpXt9,1074277981265248256,2018-12-16 12:20:04,19071682,"State College, PA",10,11,"[Phethai, India]"
1625,Dense fog (gray) &amp; freezing fog (light pink) advisories are in effect across the Great Lakes region. Be wary of red… https://t.co/BpP0A09E4t,1074260363061932033,2018-12-16 11:10:04,19071682,"State College, PA",6,2,[]
1626,"After spending most of the first half of December below 40 F, Rapid City, SD, reached 61 F on Saturday, well above… https://t.co/h3amOVt51s",1074242799355146241,2018-12-16 10:00:16,19071682,"State College, PA",5,4,[]
1627,"While dreary weather will stick around on Sunday, drier weather is in store for the Baltimore-Washington metro area… https://t.co/aFjjqzlO4a",1074225125652869121,2018-12-16 08:50:02,19071682,"State College, PA",6,4,[]
1628,"While Owen has lost wind intensity, it will track southeastward through Monday, causing downpours &amp; gusty winds to… https://t.co/uMkXjJdyTo",1074207518027603969,2018-12-16 07:40:04,19071682,"State College, PA",9,4,[]
1629,"The latest storm along the West Coast will bring rain, mountain snow, wind and dangerous waves from Washington to c… https://t.co/JMavgWGguE",1074189896607240192,2018-12-16 06:30:03,19071682,"State College, PA",20,12,[]
1630,Flooding will plague residents living along many swollen rivers in the southeastern United States despite dry weath… https://t.co/n6DmSkDd4r,1074172813479690240,2018-12-16 05:22:10,19071682,"State College, PA",12,10,[]
1631,"As a batch of heavy rain continues to move through the mid-Atlantic, flooding has been reported in Frederick County… https://t.co/FwpADrOjDb",1074154666521440257,2018-12-16 04:10:03,19071682,"State College, PA",16,13,[]
1632,Strengthening Cyclonic Storm Phethai in the Bay of Bengal may become a severe cyclonic storm with eventual impacts… https://t.co/6oMaAzelRt,1074138305443323907,2018-12-16 03:05:03,19071682,"State College, PA",20,14,[]
1633,"A storm will continue to bring rain, fog, ice and a wintry mix to parts of the northeastern United States this week… https://t.co/9lzMfLvdax",1074119436007821312,2018-12-16 01:50:04,19071682,"State College, PA",16,9,[]
1634,"Storm Deirdre is taking aim at the United Kingdom, threatening to cause widespread travel hazards and disruptions t… https://t.co/FuGGy4BkZy",1074101814797262849,2018-12-16 00:40:03,19071682,"State College, PA",11,10,[]
1635,Large storms and cold air are likely to take a break over much of the nation during much of next week ahead of the… https://t.co/R0FU0uBvtS,1074085458349580288,2018-12-15 23:35:03,19071682,"State College, PA",44,29,[]
1636,"Rain, wind, mountain snow and rough surf will take aim at the Northwest and California at the end of the weekend as… https://t.co/iNYy0LfW6y",1074068658035548172,2018-12-15 22:28:17,19071682,"State College, PA",18,11,[]
1637,"The U.S. Geological Survey reports a magnitude 5.6 earthquake has hit 89 km ESE of Lakatoro, Vanuatu at a depth of… https://t.co/pFqhLkFJc3",1074043634327146496,2018-12-15 20:48:51,19071682,"State College, PA",12,11,[]
1638,"A storm will continue to bring rain, fog, ice and a wintry mix to parts of the northeastern United States this week… https://t.co/ADC9kDO5Eu",1074037286596198400,2018-12-15 20:23:38,19071682,"State College, PA",29,13,[]
1639,Powerful storm Deirdre is expected to continue to cause widespread disruptions in the United Kingdom through Sunday… https://t.co/G8YbcG1RTs,1074017303916875777,2018-12-15 19:04:14,19071682,"State College, PA",19,8,[]
1640,Strengthening Cyclonic Storm Phethai in the Bay of Bengal may become a severe cyclonic storm with eventual impacts… https://t.co/byTWh9OelA,1074004285929783296,2018-12-15 18:12:30,19071682,"State College, PA",26,9,[]
1641,Holiday festivities may be disrupted as a period of snow could cause slick travel from northern France to Germany i… https://t.co/YGJtX1TyWG,1073987488346189824,2018-12-15 17:05:45,19071682,"State College, PA",17,11,[]
1642,The Giants will host the Titans at MetLife Stadium amidst wet and dreary conditions. Clouds are expected with perio… https://t.co/wujt4n8WNE,1073969950157692929,2018-12-15 15:56:04,19071682,"State College, PA",4,2,[]
1643,RT @NWSWilmingtonNC: We made it! https://t.co/FxvfECtVmp,1073952159119667202,2018-12-15 14:45:22,19071682,"State College, PA",0,234,[]
1644,"Rain, wind, mountain snow and rough surf will take aim at the Northwest and California at the end of the weekend as… https://t.co/mKSYP8PJzt",1073920627675971585,2018-12-15 12:40:04,19071682,"State College, PA",8,3,[]
1645,"Rain, wind, mountain snow and rough surf will take aim at the Northwest and California at the end of the weekend as… https://t.co/bUHpuwCIvm",1073919204699619328,2018-12-15 12:34:25,19071682,"State College, PA",26,8,[]
1646,Freezing fog is being reported across Michigan this morning. Motorists will need to use caution as slick spots are… https://t.co/tmF0E7UbpH,1073903021749399553,2018-12-15 11:30:07,19071682,"State College, PA",8,4,[]
1647,"Little Rock, AR, picked up 1.71"" of rain on Friday, which broke the daily record of 1.29"" set 116 years ago in 1902… https://t.co/jj29TFQ8hY",1073885393483956224,2018-12-15 10:20:04,19071682,"State College, PA",8,8,[]
1648,Thousands remain without power in western Washington after a storm system whipped up gusty winds late Friday. A new… https://t.co/OR2loOQ6fd,1073867785422471169,2018-12-15 09:10:06,19071682,"State College, PA",3,8,[]
1649,"#StormDeirdre is taking aim at the United Kingdom, threatening to cause widespread travel hazards and disruptions t… https://t.co/lDP8lWy4Dj",1073850213159395328,2018-12-15 08:00:16,19071682,"State College, PA",5,5,[StormDeirdre]
1650,"A new daily record rainfall was set at Evansville, Indiana, on Friday as 1.65"" of rain fell. This broke the previou… https://t.co/ekAxXz11tR",1073832543189983232,2018-12-15 06:50:03,19071682,"State College, PA",2,2,[]
1651,NFL Week 15: Football fans headed to games across the Northeast should prepare for wet weather at tailgates and dur… https://t.co/Yqyse1RhIZ,1073814925649305600,2018-12-15 05:40:03,19071682,"State College, PA",1,2,[]
1652,"The rain into this weekend will give way to drier, sunnier weather in Wilmington, NC, during the first half of next… https://t.co/1ByGNXfyre",1073797314307870720,2018-12-15 04:30:04,19071682,"State College, PA",4,1,[]
1653,"Rain and an icy mix will spread over the mid-Atlantic Saturday night into Sunday, potentially causing travel delays… https://t.co/OrOny8hI1R",1073778442968227840,2018-12-15 03:15:05,19071682,"State College, PA",29,9,[]
1654,"Heavy, training thunderstorms could cause flooding in Florida into Friday night. Locally gusty winds may also lead… https://t.co/22eZAkMmFC",1073759988017958913,2018-12-15 02:01:45,19071682,"State College, PA",11,9,[]
1655,"A series of storms will deliver rounds of heavy rain, mountain snow and gusty winds to the northwestern United Stat… https://t.co/cVkCDg6u1C",1073749496717287424,2018-12-15 01:20:03,19071682,"State College, PA",15,4,[]
1656,"RT @Brittany_Boyer: One for the record books! Record rainfall today in Charleston and North Myrtle Beach, SC. Still a few showers out there…",1073730255985229824,2018-12-15 00:03:36,19071682,"State College, PA",0,10,[]
1657,A potent storm could bring snow and/or freezing rain to Wales (away from the coast) and much of England and Scotlan… https://t.co/EqunHP5pni,1073728115719979011,2018-12-14 23:55:06,19071682,"State College, PA",12,12,[]
1658,"RT @StormOfCorn: It has been an extremely wet couple of days in Arkansas.  Specifically the Little Rock area has been hit hard, with over 5…",1073713237730971648,2018-12-14 22:55:59,19071682,"State College, PA",0,6,[]
1659,Much of the United States will see a break from the chilly air and big storms ahead of Christmas:… https://t.co/AJGYwOysTC,1073706731639844870,2018-12-14 22:30:07,19071682,"State College, PA",23,10,[]
1660,"A band of snow and/or icy mix will sweep eastward across northern mainland Europe this weekend, potentially disrupt… https://t.co/skBn1gDMsw",1073685800884338689,2018-12-14 21:06:57,19071682,"State College, PA",19,15,[]
1661,RT @AccuAstronomy: A comet will make an unusually close approach to Earth this weekend and may be visible in the night sky. Where to look t…,1073662698913718273,2018-12-14 19:35:09,19071682,"State College, PA",0,38,[]
1662,"Cyclone Owen is making a second landfall in Queensland, Australia as a Category 3 severe tropical cyclone, equivale… https://t.co/SFnL2yU4Jk",1073643869483556864,2018-12-14 18:20:20,19071682,"State College, PA",15,6,[]
1663,"With the combination of heavy rain and melting snow, flash flooding and clogged storm drains may cause concerns thr… https://t.co/VOMs1OKRgk",1073629056334221313,2018-12-14 17:21:28,19071682,"State College, PA",9,5,[]
1664,"The northern edge of a storm unleashing flooding rain in the southeastern United States will bring rain, fog, ice a… https://t.co/mxN49wYaJR",1073621400332746752,2018-12-14 16:51:03,19071682,"State College, PA",10,8,[]
1665,"A series of storms will take aim at the Pacific Northwest and unleash heavy rain, fog, mountain snow and gusty wind… https://t.co/EW95jYnBg9",1073608663917649920,2018-12-14 16:00:26,19071682,"State College, PA",10,9,[]
1666,RT @NWSCharlestonSC: Numerous reports of roads closed due to flooding. Do NOT drive through flood waters! #scwx #chswx,1073588303113412609,2018-12-14 14:39:32,19071682,"State College, PA",0,23,"[scwx, chswx]"
1667,"Heavy rain will bring the risk of flooding, as well as roof collapses, in areas where heavy snow fell last week in… https://t.co/sMq46Ojumz",1073582778711719937,2018-12-14 14:17:35,19071682,"State College, PA",14,12,[]
1668,A storm will threaten to bring wind gusts between 60 and 70 mph (95 and 115 km/h) near the coast from Wales and wes… https://t.co/aSJfzuqlIU,1073546454080339969,2018-12-14 11:53:14,19071682,"State College, PA",10,6,[]
1669,Severe storms are firing up in northern Louisiana with damaging winds and large hail. Latest severe alerts:… https://t.co/pAhUtTqlgk,1073521369613287425,2018-12-14 10:13:34,19071682,"State College, PA",14,12,[]
1670,Heavy storms will bring the risk of localized severe weather to parts of Florida on Friday: https://t.co/qDr1YVEKBC https://t.co/v70CSq1MRb,1073502998469492738,2018-12-14 09:00:34,19071682,"State College, PA",5,8,[]
1671,"Little Rock, AR, has now received over 6"" of rain so far this month. Average precipitation for all of December is 4… https://t.co/44YlxSAz1K",1073485262754324480,2018-12-14 07:50:05,19071682,"State College, PA",7,3,[]
1672,"After snow buried areas to the west of Abilene, Texas, on Thursday, dry, milder weather is in store to end the week… https://t.co/Wxw8m3FxqA",1073466387102863360,2018-12-14 06:35:05,19071682,"State College, PA",8,5,[]
1673,Seas will build ahead of the next storm set to pummel the Northwest at the end of the week: https://t.co/jBrgU35mqC… https://t.co/om04SNaJ2k,1073447503192834048,2018-12-14 05:20:03,19071682,"State College, PA",6,6,[]
1674,"Pensacola, Florida, has picked up 1.50"" of rain in the past 6 hours. The heavy rain will sweep toward the southern… https://t.co/dj8BQ520qc",1073429885992005632,2018-12-14 04:10:02,19071682,"State College, PA",10,6,[]
1675,A newly formed depression in the Bay of Bengal is expected to develop into a tropical cyclone in the next 48 hours… https://t.co/AT55xlAfgR,1073411024294944768,2018-12-14 02:55:05,19071682,"State College, PA",36,16,[]
1676,Heavy to locally severe thunderstorms are likely over Florida and may extend northward along the southern Atlantic… https://t.co/x5GZtiHp7I,1073393406892826629,2018-12-14 01:45:05,19071682,"State College, PA",18,13,[]
1677,What are the chances for a white Christmas this year across the United States? https://t.co/tiZuFC0LJP https://t.co/lQYRTeyaU1,1073374532847702016,2018-12-14 00:30:05,19071682,"State College, PA",58,25,[]
1678,"RT @jpetramala: Flooding is beginning to creep back into the Carolinas.  The Lumber River near Lumberton, NC, already flooding roads and ev…",1073361122923872256,2018-12-13 23:36:48,19071682,"State College, PA",0,31,[]
1679,Snow and sleet have been reported in parts of western and central Texas this afternoon and may lead to slick travel… https://t.co/83kAcjZkaF,1073352858291134465,2018-12-13 23:03:58,19071682,"State College, PA",14,9,[]
1680,RT @NWSFortWorth: 3:55PM Radar Update: Showers and thunderstorms continue in Grayson and Collin counties.  Heavy rainfall is causing some m…,1073336313137512449,2018-12-13 21:58:13,19071682,"State College, PA",0,8,[]
1681,"RT @AccuAstronomy: Tonight is the peak of the #Geminid meteor shower. Here’s what you need to know: 
-Up to 120 meteors per hour in dark ar…",1073329820522700800,2018-12-13 21:32:25,19071682,"State College, PA",0,34,[Geminid]
1682,Areas of the northwestern United States and British Columbia can expect a potential 15-20 inches of rain along with… https://t.co/CLB0n2Pl8Q,1073324381244395520,2018-12-13 21:10:48,19071682,"State College, PA",34,21,[]
1683,"A potent storm in the United Kingdom is expected to unload blizzard conditions, soaking rain and strong winds this… https://t.co/4hKwuwlMV5",1073308288505311232,2018-12-13 20:06:51,19071682,"State College, PA",11,12,[]
1684,RT @NWSAmarillo: We have observed #tumbleweeds migrating south at a very quick pace today. #phwx #txwx #okwx https://t.co/suEG9ZFqOY,1073292315538714627,2018-12-13 19:03:23,19071682,"State College, PA",0,88,"[tumbleweeds, phwx, txwx, okwx]"
1685,Tropical Cyclone #Owen will bring the risk of flooding and damaging winds to parts of Northern Territory and Queens… https://t.co/4mvIyrbuGm,1073281416505503744,2018-12-13 18:20:04,19071682,"State College, PA",6,4,[Owen]
1686,"@squagliozzi @njdotcom @ABC7NY @News12NJ Hi Sabrina, we would love to use this video in our syndicated news coverag… https://t.co/0hYvLKxW4r",1073261550469816321,2018-12-13 17:01:08,19071682,"State College, PA",1,0,[]
1687,Large storms and cold air are likely to take a break over much of the nation during much of next week ahead of the… https://t.co/XqmARLnOHx,1073261524154753027,2018-12-13 17:01:02,19071682,"State College, PA",20,16,[]
1688,Thursday night will feature hundreds of meteors streaking across the night sky as the Geminids reach their peak:… https://t.co/4UsqzkFZxR,1073242542660087808,2018-12-13 15:45:36,19071682,"State College, PA",41,32,[]
1689,"RT @NWSBrownsville: Fun fact: Our office has only issued 4 'High Wind Warnings' over the past 30 years, including today's. Our last 'High W…",1073240263324258304,2018-12-13 15:36:33,19071682,"State College, PA",0,19,[]
1690,A series of storms will train across the northwestern United States and British Columbia into next week with period… https://t.co/fnlkZC40DR,1073224789832204288,2018-12-13 14:35:04,19071682,"State College, PA",9,7,[]
1691,"While the next storm on the way for the eastern US will be warmer when compared to last weekend's storm, it may cre… https://t.co/zB4okx8ztO",1073208475533107200,2018-12-13 13:30:14,19071682,"State College, PA",17,15,[]
1692,"Rain, as well as wintry weather in some locations, will unfold across the south-central US today:… https://t.co/bzCuTnB37O",1073192604748144641,2018-12-13 12:27:10,19071682,"State College, PA",16,8,[]
1693,Heavy storms pushing through Houston this morning could lead to delays on the roadways. Latest forecast:… https://t.co/k8PnfacHZ8,1073170119696834560,2018-12-13 10:57:49,19071682,"State College, PA",7,8,[]
1694,A newly formed depression in the Bay of Bengal is expected develop into a tropical cyclone in the next 48 hours and… https://t.co/dSblAnkuvF,1073153066705276930,2018-12-13 09:50:03,19071682,"State College, PA",231,170,[]
1695,High wind warning are in effect across the southern Plains as a storm whips up gusty winds into Thursday night:… https://t.co/hKMI6q0PtE,1073134327385546752,2018-12-13 08:35:36,19071682,"State College, PA",12,13,[]
1696,Heavy rain on top of a deep snowpack in portions of North Carolina and Virginia may lead to flooding problems at th… https://t.co/bIcB7nfarL,1073117843695288320,2018-12-13 07:30:06,19071682,"State College, PA",6,11,[]
1697,"While portions of Texas will receive accumulating snow on Thursday and Thursday night, milder air will quickly melt… https://t.co/J0LQXnQMBG",1073097702806904833,2018-12-13 06:10:04,19071682,"State College, PA",11,12,[]
1698,"Track the snowy weather sweeping through Colorado on radar: https://t.co/gF24FpdLRL

 https://t.co/8sNjihJn2K",1073079078842974209,2018-12-13 04:56:03,19071682,"State College, PA",14,2,[]
1699,"After a brief break from wet weather on Wednesday, rain has returned to Seattle and is expected to continue through… https://t.co/gkImdwhFRH",1073059938598035457,2018-12-13 03:40:00,19071682,"State College, PA",15,7,[]
1700,RT @NWSCheyenne: Strong winds and snow have reached Cheyenne expect visibility of 1/2 mile and slick roads for the next 45 minutes to an ho…,1073044299112161280,2018-12-13 02:37:51,19071682,"State College, PA",0,21,[]
1701,While a storm is set to bring mostly rain and thunderstorms to much of the south-central United States from Wednesd… https://t.co/EH22LN67mg,1073029750543843328,2018-12-13 01:40:03,19071682,"State College, PA",34,26,[]
1702,A series of storms will train across the northwestern United States and British Columbia into next week with period… https://t.co/rmBu85d6vd,1073012149063168000,2018-12-13 00:30:06,19071682,"State College, PA",23,18,[]
1703,Thursday night will feature hundreds of meteors streaking across the night sky as the Geminid shower reaches its pe… https://t.co/8As7z6CZxG,1072994647406993409,2018-12-12 23:20:33,19071682,"State College, PA",46,40,[]
1704,Tropical Cyclone #Owen will bring the risk of flooding and damaging winds to parts of Northern Territory and Queens… https://t.co/5fMzBdUaEp,1072976826744627201,2018-12-12 22:09:45,19071682,"State College, PA",10,16,[Owen]
1705,The Southeast will see a soaking rain just days after a major snowstorm. Rain falling on snow-covered areas could c… https://t.co/V4M42egV5D,1072958030944370697,2018-12-12 20:55:03,19071682,"State College, PA",15,15,[]
1706,"RT @AccuRayno: Never, ever trust an Upper low. Watch out Texas! https://t.co/ctUztBzjD5",1072949035735179264,2018-12-12 20:19:19,19071682,"State College, PA",0,20,[]
1707,"Thursday morning commutes could be disrupted in the mid-Atlantic as a batch of snow passes over Pennsylvania, New Y… https://t.co/uua2cN4tow",1072937902311698434,2018-12-12 19:35:04,19071682,"State College, PA",13,9,[]
1708,RT @AccuAstronomy: A green comet will make an unusually close encounter with Earth this weekend and may be bright enough to see without a t…,1072920724829061120,2018-12-12 18:26:49,19071682,"State College, PA",0,110,[]
1709,"A parade of storms will deliver rounds of heavy rain, gusty winds and mountain snow to the northwestern US during m… https://t.co/vJvAZ3ILc2",1072899918149369857,2018-12-12 17:04:08,19071682,"State College, PA",28,18,[]
1710,Wind gusts frequenting 50-70 mph are forecast for many areas from western and central Montana to north-central and… https://t.co/YXZot8Zwl7,1072881750169280512,2018-12-12 15:51:57,19071682,"State College, PA",36,20,[]
1711,RT @ReedTimmerAccu: Sunrise on fire over the northern Rocky Mountains ahead of fast-moving snow/wind producer @breakingweather @accuweather…,1072866869089046528,2018-12-12 14:52:49,19071682,"State College, PA",0,34,[]
1712,Some slippery travel conditions reported around the Minneapolis area this morning. Radar: https://t.co/UqOLuhR92B https://t.co/tMBdTAY22K,1072838778258161664,2018-12-12 13:01:11,19071682,"State College, PA",15,3,[]
1713,The second storm in less than a week will soon roll through the south-central United States: https://t.co/6e67eFV8bm https://t.co/Bn0e1Tylq6,1072826804816232448,2018-12-12 12:13:37,19071682,"State College, PA",15,9,[]
1714,A quick-hitting storm may drop just enough snow to create slippery travel from the Great Lakes to the central Appal… https://t.co/IpwzwSa5j5,1072806068764508160,2018-12-12 10:51:13,19071682,"State College, PA",11,7,[]
1715,"A 4.4 magnitude earthquake struck at 4:14 a.m. EST about 6.8 miles north-northeast of Decatur, Tennessee. Residents… https://t.co/QT84eBmyxx",1072788999750778880,2018-12-12 09:43:23,19071682,"State College, PA",96,75,[]
1716,"After Seattle only received 0.13"" of rain during the first 8 days of December, the city has picked up nearly 1.50""… https://t.co/nSiz6hLx7Z",1072778219106000896,2018-12-12 09:00:33,19071682,"State College, PA",8,11,[]
1717,A potent winter storm will bring heavy snow to parts of Ukraine into Wednesday and bring accumulating snowfall to p… https://t.co/szVK1K4Xgg,1072760481528639489,2018-12-12 07:50:04,19071682,"State College, PA",6,6,[]
1718,"While chilly air will linger in areas of North Carolina that were buried by the latest snowstorm, a turn to milder… https://t.co/Jn4dmcSyD7",1072742862977159170,2018-12-12 06:40:03,19071682,"State College, PA",8,9,[]
1719,"The storm that brought the gusty winds to the Pacific Northwest will exit at midweek, but another storm will quickl… https://t.co/gRpL9zMNSb",1072724080942571520,2018-12-12 05:25:25,19071682,"State College, PA",7,2,[]
1720,Over a foot of snow has piled up in the Washington Cascades as a storm continues to roll through the area:… https://t.co/UlML1XsU33,1072705115033927681,2018-12-12 04:10:03,19071682,"State College, PA",15,8,[]
1721,While a storm is set to bring mostly rain and thunderstorms to much of the south-central United States from late We… https://t.co/41DZzIi810,1072687518540288001,2018-12-12 03:00:08,19071682,"State College, PA",18,14,[]
1722,"The next major storm for the southern and eastern United States, currently scheduled from Thursday, Dec. 13, to Sun… https://t.co/0863UTgvI0",1072669881395482625,2018-12-12 01:50:03,19071682,"State College, PA",34,21,[]
1723,Tropical Cyclone Owen will bring the risk of flooding and damaging winds to parts of Northern Territory and Queensl… https://t.co/SJOvw10WaM,1072652129653919745,2018-12-12 00:39:31,19071682,"State College, PA",7,5,[]
1724,Thursday night will feature hundreds of meteors streaking across the night sky as the Geminid shower reaches its pe… https://t.co/9MFawzUBcX,1072633459930226689,2018-12-11 23:25:20,19071682,"State College, PA",41,39,[]
1725,"Snow will spread across the Rocky Mountains at midweek, blanketing most of the region’s ski resorts:… https://t.co/wZWt3gD6Mq",1072612547315027972,2018-12-11 22:02:14,19071682,"State College, PA",14,10,[]
