,tweet,id,time,user,location,favourites,retweet-count,hashtags
805,"Track the snow that is causing slippery travel across the Midwest on radar: https://t.co/eUYlFQ3tiK

https://t.co/5IRKkDkNDW",1087930439615041536,2019-01-23 04:30:04,19071682,"State College, PA",11,4,[]
806,"Following a quick blast of Arctic air, a slow-moving storm will drench the southern United States and raise the ris… https://t.co/T798wSKJ9J",1087911575279861760,2019-01-23 03:15:06,19071682,"State College, PA",37,22,[]
807,RT @NWSSpokane: Hazardous travel is expected over the Cascade passes tonight.  Be prepared for snow covered roads and restrictions.  Be sur…,1087895379729940480,2019-01-23 02:10:45,19071682,"State College, PA",0,11,[]
808,Snow and ice will sweep through the midwestern United States into tonight ahead of the next blast of Arctic air poi… https://t.co/jSDI9F1ptk,1087882999541231616,2019-01-23 01:21:33,19071682,"State College, PA",27,19,[]
809,"Parts of western Europe, including much of the Netherlands, Belgium and France, will look like a winter wonderland… https://t.co/tvTOkPMk9p",1087860362056060928,2019-01-22 23:51:36,19071682,"State College, PA",20,15,[]
810,A slow-moving storm will drench the southern United States and raise the risk of localized flooding into Thursday.… https://t.co/N9UUm7fh7R,1087840960925614081,2019-01-22 22:34:30,19071682,"State College, PA",15,8,[]
811,RT @Brittany_Boyer: SLIPPERY ROADS: Winter weather advisories for parts of the Northeast on Wednesday as there could be a period of freezin…,1087820212307660804,2019-01-22 21:12:03,19071682,"State College, PA",0,15,[]
812,"The Tuesday evening and Wednesday morning commutes may be disrupted across the Midwest as snow, ice and rain spread… https://t.co/NY6WWNMYFt",1087819728415014912,2019-01-22 21:10:08,19071682,"State College, PA",16,8,[]
813,"A strengthening storm will spread rain, ice and snow over Italy and the Balkan Peninsula late this week and into th… https://t.co/QgiBbRMxCq",1087799579049889794,2019-01-22 19:50:04,19071682,"State College, PA",3,4,[]
814,"New York City, Boston and Philadelphia could see urban flooding on Wednesday night and Thursday as heavy rain drenc… https://t.co/YULxMXWcXB",1087780706288324608,2019-01-22 18:35:05,19071682,"State College, PA",24,14,[]
815,Another blast of Arctic air will chill the eastern United States at the end of the week and into the weekend:… https://t.co/x9zWXcOvQK,1087761644573376513,2019-01-22 17:19:20,19071682,"State College, PA",23,23,[]
816,"As a potent storm slides across the interior West, gusty winds will create difficult travel for some motorists acro… https://t.co/zwdhYKJGXF",1087740933897179136,2019-01-22 15:57:02,19071682,"State College, PA",9,5,[]
817,Icy conditions will prompt travel concerns across parts of the mid-Atlantic and Northeast on Wednesday:… https://t.co/yLPGG2tQbW,1087722845428506624,2019-01-22 14:45:09,19071682,"State College, PA",10,13,[]
818,Snow and ice will sweep through the midwestern United States into Tuesday night ahead of the next blast of Arctic a… https://t.co/83IvuaZvO2,1087693988784730113,2019-01-22 12:50:29,19071682,"State College, PA",18,14,[]
819,"After a record-setting 8.6"" of snow fell in Tooele, Utah, on Monday (previous daily record was 8"" from 1974), dry b… https://t.co/LzyvwNyni0",1087661167345090560,2019-01-22 10:40:04,19071682,"State College, PA",8,6,[]
820,"On Monday, Boston's high of 10 F set a new record minimum daytime temperature for the date, beating out the high of… https://t.co/TfEuYPFuG4",1087643560793518080,2019-01-22 09:30:06,19071682,"State College, PA",19,18,[]
821,"Gusty winds will whip through parts of the Southwest on Tuesday, including Southern California. Wind advisories are… https://t.co/bxMAyAR7kT",1087625933736103937,2019-01-22 08:20:04,19071682,"State College, PA",8,5,[]
822,"The current temperature in Pittsburgh (0 F) is 20 degrees lower than the temperature in Anchorage, Alaska (20 F). A… https://t.co/jpHH0ZrjLg",1087609227835789318,2019-01-22 07:13:41,19071682,"State College, PA",13,15,[]
823,Rain and mountain snow moving into northwestern #India this week will bring improved air quality to areas from New… https://t.co/KAzQHm3spR,1087585664433045504,2019-01-22 05:40:03,19071682,"State College, PA",7,5,[India]
824,"Cheyenne, Wyoming, is running below average for snowfall so far this month. Track the snow that is helping to cut i… https://t.co/TMGDOSI18K",1087568054177988608,2019-01-22 04:30:04,19071682,"State College, PA",15,4,[]
825,A quick-hitting shot of snow to start the new week across the Rockies will be enough to cause travel issues but a f… https://t.co/kQThLYLruZ,1087550923071725568,2019-01-22 03:22:00,19071682,"State College, PA",8,4,[]
826,Jupiter and Venus will shine bright together before dawn on Tuesday in an astronomical event known as a conjunction… https://t.co/3qwPBVKvqm,1087530599206785024,2019-01-22 02:01:14,19071682,"State College, PA",55,29,[]
827,A brief surge of warmer air at midweek will be accompanied by a storm that brings drenching rain and the risk of ur… https://t.co/BHaYkaJWty,1087513754651279361,2019-01-22 00:54:18,19071682,"State College, PA",18,8,[]
828,"Following a quick blast of Arctic air, a slow-moving storm will drench the southern United States and raise the ris… https://t.co/SsZOHVwoSF",1087498079912280064,2019-01-21 23:52:01,19071682,"State College, PA",23,16,[]
829,"It is currently -29F with an AccuWeather  RealFeel® Temperature of -87F at the top of Mount Washington, NH, as frig… https://t.co/NmHT2ePewK",1087474959805566977,2019-01-21 22:20:09,19071682,"State College, PA",41,19,[]
830,Schools may be delayed on Wednesday morning from western North Carolina into Upstate New York as ice and freezing r… https://t.co/PFrrGYlZHp,1087459840161660928,2019-01-21 21:20:04,19071682,"State College, PA",21,11,[]
831,The 1st widespread snowfall of the year will whiten the Netherlands to France on Tuesday and Wednesday:… https://t.co/JYo3sWXEtZ,1087439819280707585,2019-01-21 20:00:31,19071682,"State College, PA",21,15,[]
832,RT @Brittany_Boyer: What a time to be a skier or snowboarder out west ⛷️🏂 !! A great list put together by @NWSReno of mountain snow reports…,1087438351425290240,2019-01-21 19:54:41,19071682,"State College, PA",0,33,[]
833,Gusty winds will blow across the southwestern US through Tuesday that could cause airline delays and strong cross w… https://t.co/y0JUE7d98Z,1087421503455539200,2019-01-21 18:47:44,19071682,"State College, PA",16,17,[]
834,"A dangerous winter storm moved across the Midwest and Northeast over the weekend, bringing some of the lowest tempe… https://t.co/aSAdwDYnvg",1087402028178067456,2019-01-21 17:30:21,19071682,"State College, PA",11,11,[]
835,A significant amount of snow is expected from parts of the central Plains to the Upper Midwest during Tuesday to Tu… https://t.co/AgtGJVAxs3,1087389381252579328,2019-01-21 16:40:05,19071682,"State College, PA",23,13,[]
836,"A record low temperature of minus 12 degrees was set in Muskegon, Michigan, today. This breaks the old record of mi… https://t.co/tkwSUOZvGL",1087364348471848967,2019-01-21 15:00:37,19071682,"State College, PA",37,11,[]
837,"A storm will affect the Midwest with areas of snow, ice and rain as air changes hands from frigid conditions to mil… https://t.co/mbVqF7fRgy",1087334314348556288,2019-01-21 13:01:16,19071682,"State College, PA",14,11,[]
838,"A brief surge of warmer air at midweek will be accompanied by a storm that brings drenching rain, but also areas of… https://t.co/oFkKqHoIre",1087306329910329344,2019-01-21 11:10:04,19071682,"State College, PA",8,6,[]
839,Residents of the Philippines will face the dangers of flash flooding and mudslides as a tropical depression impacts… https://t.co/zkVHnPw4am,1087288829525012481,2019-01-21 10:00:32,19071682,"State College, PA",15,8,[]
840,"Salt Lake City, Utah, has only picked up 28% of its normal month-to-date snowfall (2.4"" compared to the average of… https://t.co/Blqat4Amyw",1087271099149307904,2019-01-21 08:50:05,19071682,"State College, PA",8,8,[]
841,Blowing snow and brutal cold will remain concerns across the Northeast as the new week begins:… https://t.co/65U4uS3y2m,1087253795673948160,2019-01-21 07:41:19,19071682,"State College, PA",12,13,[]
842,"Burlington, Vermont, recorded 15.6"" of snow on Sunday, which broke the daily record of 10.6"" from 1978:… https://t.co/cAkFOdH0Au",1087236012722581504,2019-01-21 06:30:39,19071682,"State College, PA",41,26,[]
843,"Track the heavy snow pummeling the Sierra Nevada on radar: https://t.co/81utaPaThd

https://t.co/W6sI0bJhBG",1087217093035126784,2019-01-21 05:15:29,19071682,"State College, PA",28,8,[]
844,"RT @AccuAstronomy: The #TotalLunarEclipse is underway!
Step outside now to see the eclipsed moon. It should appear orange or red for the ne…",1087211696190558208,2019-01-21 04:54:02,19071682,"State College, PA",0,53,[TotalLunarEclipse]
845,"Snow showers continue to stream off of Lake Michigan, potentially creating slick road conditions in portions of nor… https://t.co/KwqJVvnF8W",1087200627766247424,2019-01-21 04:10:03,19071682,"State College, PA",8,2,[]
846,"Out of season rain moving into northwestern India this week may improve air quality in areas from New Delhi, Jaipur… https://t.co/ScoIYQx4t0",1087183021734879232,2019-01-21 03:00:05,19071682,"State College, PA",15,7,[]
847,"RT @AccuAstronomy: The #LunarEclipse is underway!
The Moon will gradually become dimmer until the total eclipse starts at 11:41pm ET/ 8:41p…",1087177865169457152,2019-01-21 02:39:36,19071682,"State College, PA",0,64,[LunarEclipse]
848,RT @AdamDWeather: Grab an extra blanket tonight! @AccuWeather RealFeel temps drop to as low as -30°F from Central PA to Maine! https://t.co…,1087169513509003264,2019-01-21 02:06:25,19071682,"State College, PA",0,20,[]
849,A quick-hitting shot of snow to start the new week across the Rockies will be enough to cause travel issues but a f… https://t.co/9hsi9FQlS3,1087152467161300992,2019-01-21 00:58:41,19071682,"State College, PA",18,12,[]
850,"RT @ReedTimmerAccu: Possible #tornado looks to be passing just west/north of Copperopolis, CA as of 345 pm! @breakingweather @accuweather #…",1087134777369612288,2019-01-20 23:48:23,19071682,"State College, PA",0,26,[tornado]
851,"RT @ReedTimmerAccu: Possible #tornadoes with cluster of supercells east of Linden, CA just to my southwest! Will be dumping heavy snow when…",1087124600486535169,2019-01-20 23:07:57,19071682,"State College, PA",0,34,[tornadoes]
852,RT @NWSSacramento: 2:30pm - Tornado warning issued for Northeastern San Joaquin County near Linden until 3:30pm. Take shelter immediately i…,1087116485586227200,2019-01-20 22:35:42,19071682,"State College, PA",0,180,[]
853,A brief surge of warmer air at midweek will be accompanied by a storm that brings drenching rain and the risk of ur… https://t.co/F9uoCLLZB7,1087095374806962176,2019-01-20 21:11:49,19071682,"State College, PA",9,10,[]
854,"RT @AccuAstronomy: The latest cloud forecast for tonight's Total Lunar Eclipse, the last of its kind until 2021. 
Complete forecast and why…",1087081991244316673,2019-01-20 20:18:38,19071682,"State College, PA",0,36,[]
855,"Another storm will affect the Midwest with areas of snow, ice and rain at midweek: https://t.co/ImY60rnivI https://t.co/NzZrcjMlKd",1087062326262620162,2019-01-20 19:00:29,19071682,"State College, PA",65,34,[]
856,Temperatures currently range from lower 50s on Cape Cod to the teens in the northwestern suburbs of Boston as rain… https://t.co/ZpT7FFvWQp,1087045587818680320,2019-01-20 17:53:59,19071682,"State College, PA",9,4,[]
857,"RT @AccuAstronomy: Here is a breakdown of tonight's Total #LunarEclipse. 
The Moon will only appear red during totality, which will last fo…",1087039525891784704,2019-01-20 17:29:53,19071682,"State College, PA",0,71,[LunarEclipse]
858,A look at some of the highest snowfall amounts reported from the winter storm so far from the mid-Atlantic to New E… https://t.co/0Va8tYH9Lq,1087026986009219074,2019-01-20 16:40:04,19071682,"State College, PA",46,25,[]
859,RT @NWSBirmingham: Here are a few photos from our survey. These were taken near the First Baptist &amp; First Presbyterian Churches on Bridge S…,1087024184801325056,2019-01-20 16:28:56,19071682,"State College, PA",0,71,[]
860,"Sunday started with rain in Boston, but a drop in temperatures has brought the ice storm to the city:… https://t.co/reZqNYqII0",1087013142658457603,2019-01-20 15:45:03,19071682,"State College, PA",19,12,[]
861,@JeffTwinsfather Thank you!,1086994627788488710,2019-01-20 14:31:29,19071682,"State College, PA",1,0,[]
862,Temperatures will be on a free fall across most of New England &amp; the mid-Atlantic on Sunday with highs being record… https://t.co/sjXcr4eU7k,1086994348380700673,2019-01-20 14:30:22,19071682,"State College, PA",20,7,[]
863,@ScottFordTVGuy @accuweather Thank you,1086978795171651585,2019-01-20 13:28:34,19071682,"State College, PA",1,0,[]
864,"if you are waking up to slush in the Northeast, now is the time to clear it before Arctic air sweeps in and turns i… https://t.co/nYhbNp2jIs",1086976655715909632,2019-01-20 13:20:04,19071682,"State College, PA",27,21,[]
865,"@ScottFordTVGuy @accuweather Wow. We hope everyone is safe out there. Did you take this video? If so, may we use th… https://t.co/Dq6l6NHFkA",1086974234419703808,2019-01-20 13:10:27,19071682,"State College, PA",0,0,[]
866,Travel is not advised across much of the Northeast this morning as snow and ice continues to pound the region. Trac… https://t.co/0fBiId01Bx,1086959039693684736,2019-01-20 12:10:04,19071682,"State College, PA",14,11,[]
867,"While one of today's NFL games will be played under the shelter of the Superdome, players and fans in Arrowhead Sta… https://t.co/Q5JBs11ZgO",1086941483897372672,2019-01-20 11:00:18,19071682,"State College, PA",7,8,[]
868,"The winter storm in the eastern U.S. has proved destructive has far south as the Gulf Coast. On Saturday, storms an… https://t.co/u9SuZwuK9A",1086922543049699328,2019-01-20 09:45:02,19071682,"State College, PA",13,9,[]
869,"Snow Emergencies have been declared for several counties in central Ohio, putting various travel bans into effect a… https://t.co/G7VOKFZx8H",1086903678055956480,2019-01-20 08:30:05,19071682,"State College, PA",23,12,[]
870,"A new daily snowfall record was set in Rochester, NY on Saturday, where 7.8 inches accumulated. This beats the old… https://t.co/IskRPVW3iU",1086888584303575040,2019-01-20 07:30:06,19071682,"State College, PA",26,15,[]
871,"While Saturday started with a round of severe storms in Jackson, Mississippi, snow showers were reported in the are… https://t.co/APySZBu8S6",1086870954586853376,2019-01-20 06:20:03,19071682,"State College, PA",16,7,[]
872,"At 11pm local time on Friday, it was a balmy 63 F in Dallas - 24 hours later, the temperature has plummeted to just… https://t.co/AtCokKslzy",1086854396099678208,2019-01-20 05:14:15,19071682,"State College, PA",18,6,[]
873,A few more inches of snow are expected to accumulate before sleet and freezing rain take over in central Pennsylvan… https://t.co/3KptaWKpbN,1086838525054590977,2019-01-20 04:11:11,19071682,"State College, PA",45,13,[]
874,"RT @DHenryTV: Snow is starting to stick and the plow trucks are out in downtown Albany, NY. @breakingweather @breakingweather #Accuweather…",1086819613994876929,2019-01-20 02:56:02,19071682,"State College, PA",0,24,[Accuweather]
875,"There are reports of structural damage in La Serena, Chile after an earthquake of 6.7 hit the region:… https://t.co/xuiT5NOhdv",1086818106385879040,2019-01-20 02:50:03,19071682,"State College, PA",99,117,[]
876,"#BREAKING: U.S. Geological Survey reports a magnitude 6.8 earthquake has hit 29 km WSW of Coquimbo, Chile:… https://t.co/JJXIRulsg2",1086803531057819649,2019-01-20 01:52:08,19071682,"State College, PA",68,55,[BREAKING]
877,"While most of the stronger thunderstorms have waned, there could be a locally severe thunderstorm with the potentia… https://t.co/geBo4tStTY",1086800162679341057,2019-01-20 01:38:45,19071682,"State College, PA",13,8,[]
878,RT @BlakeNaftel: Blustery conditions kicking up plenty of blowing and drifting #snow in/around #Toledo #Ohio region this evening. Use cauti…,1086780194558566400,2019-01-20 00:19:24,19071682,"State College, PA",0,19,"[snow, Toledo, Ohio]"
879,"One lane on southbound Interstate 55 in Ste. Genevieve County, Missouri is now open. Crews hope to reopen all lanes… https://t.co/qqTejZzWks",1086764585464619008,2019-01-19 23:17:22,19071682,"State College, PA",17,3,[]
880,"Extensive damage from a possible tornado has been reported in Wetumpka, Alabama:  https://t.co/rziJlQ5gJN  (Photo:… https://t.co/qSPy9ZRzJO",1086746814508867585,2019-01-19 22:06:46,19071682,"State College, PA",67,43,[]
881,A United Airlines plane skidded off the runway at O'Hare Airport today due to weather conditions:… https://t.co/cDpqKnuyAT,1086741352715616261,2019-01-19 21:45:03,19071682,"State College, PA",27,18,[]
882,RT @MSHPTrooperC: Here are photos from a couple of the crashes that resulted in the closure of I-55 in Ste. Genevieve County. The roadway s…,1086734951167549440,2019-01-19 21:19:37,19071682,"State College, PA",0,47,[]
883,"The commercial vehicle ban in Pennsylvania has been lifted from I-83, I-81 south of I-83, I-283, I-176, and the Tur… https://t.co/EtiqGOBqIe",1086726737315147776,2019-01-19 20:46:59,19071682,"State College, PA",37,20,[]
884,"A radar-confirmed tornado is threatening communities northwest of Montgomery, Alabama: https://t.co/kVlMDMOwPu 

https://t.co/XIijMOCTR6",1086717501134852097,2019-01-19 20:10:17,19071682,"State College, PA",56,39,[]
885,A significant build-up of ice on power lines accompanied by gusty winds can lead to power outages. In the Northeast… https://t.co/3yp6Uvx1Ip,1086702737495154698,2019-01-19 19:11:37,19071682,"State College, PA",38,16,[]
886,States are reminding residents to stay off roads unless absolutely necessary and to give plows as much space as saf… https://t.co/OB2npMy7qT,1086685963743625216,2019-01-19 18:04:58,19071682,"State College, PA",53,25,[]
887,"RT @NWStornado: A tornado watch has been issued for parts of Alabama, Florida and Mississippi until 5 PM CST https://t.co/ubjQ0ZVCS7",1086650486688747521,2019-01-19 15:43:59,19071682,"State College, PA",0,64,[]
888,"While a winter storm churns to their north, residents of the lower Mississippi Valley are facing a severe weather d… https://t.co/tflOv2jUPx",1086637977026158592,2019-01-19 14:54:17,19071682,"State College, PA",38,26,[]
889,"A severe t-storm capable of produce a tornado is located near Florence and Star, Mississippi, and tracking toward B… https://t.co/LVh7rB3O2w",1086620869949116416,2019-01-19 13:46:18,19071682,"State College, PA",18,12,[]
890,"After peaking near 70 F on Friday, today's high temperature in Dallas is only 40. Combined with wind gusts as high… https://t.co/N9x2IwB5Dd",1086595391087411200,2019-01-19 12:05:03,19071682,"State College, PA",9,9,[]
891,"In the wake of this weekend's winter storm, brutally cold air will freeze snow and slush, leading to hazardous trav… https://t.co/LY7tH8lZav",1086574006839529473,2019-01-19 10:40:05,19071682,"State College, PA",31,24,[]
892,"The best viewing conditions for Sunday night's lunar eclipse will be found across the southern and eastern US, with… https://t.co/2lto6x8I6A",1086556396357865473,2019-01-19 09:30:06,19071682,"State College, PA",18,20,[]
893,"As snow overspreads the Midwest tonight, stay up-to-date with the latest snow totals, travel news and other storm i… https://t.co/XbwfAeaXnw",1086538771074609153,2019-01-19 08:20:04,19071682,"State College, PA",12,5,[]
894,"A line of strong storms has developed in eastern Texas, southern Arkansas and Louisiana overnight. Frequent lightin… https://t.co/ynX3CShnV3",1086522414039814144,2019-01-19 07:15:04,19071682,"State College, PA",20,14,[]
895,"Slick, snow-covered roads, gusty winds, and low visibility conditions will hinder travel for millions as a major wi… https://t.co/2S8Ku3OD55",1086506055570460672,2019-01-19 06:10:04,19071682,"State College, PA",27,11,[]
896,"After peaking at 99 F (37 C) on Friday, the temperature in Melbourne has reached just 75 F (24 C) today. Players an… https://t.co/W6fcSLGyCP",1086487177612144641,2019-01-19 04:55:03,19071682,"State College, PA",10,2,[]
897,"California will see a break in the stormy weather following rounds of flash flooding, mudslides and feet of mountai… https://t.co/FpHW5rQlrS",1086462928729956353,2019-01-19 03:18:42,19071682,"State College, PA",11,6,[]
898,"A substantial amount of ice could cause significant disruptions and power outages in the suburbs of Pittsburgh, Was… https://t.co/NLbLmL2Aqu",1086443164146298880,2019-01-19 02:00:10,19071682,"State College, PA",37,23,[]
899,RT @AccuAstronomy: Look to the southeast before sunrise on Tuesday to see the Jupiter-Venus Conjunction. The two planets will be hard to mi…,1086439723332263936,2019-01-19 01:46:29,19071682,"State College, PA",0,26,[]
900,"A state-by-state breakdown of the maximum snowfall, highest wind gust and lowest AccuWeather RealFeel® temperatures… https://t.co/r8YdMhkXJe",1086426776539222016,2019-01-19 00:55:03,19071682,"State College, PA",24,15,[]
901,The #Chiefs and the #Patriots are gearing up for a frigid game in Kansas City on Sunday night with the winner movin… https://t.co/QJNHGQSAdp,1086409165885636608,2019-01-18 23:45:04,19071682,"State College, PA",30,12,"[Chiefs, Patriots]"
902,Sunday night will be brutally cold in the Northeast following the major snowstorm. AccuWeather RealFeel® temperatur… https://t.co/zZjRr5rDF8,1086391866764025856,2019-01-18 22:36:19,19071682,"State College, PA",106,74,[]
903,A state of emergency has been declared in Pennsylvania and New jersey as millions brace for the weekend snowstorm a… https://t.co/GHx9NOuHWT,1086376041373933568,2019-01-18 21:33:26,19071682,"State College, PA",80,61,[]
904,"The latest snowfall forecast for the Northeast this weekend: https://t.co/207AAkYVnW
A widespread 12-24 inches of s… https://t.co/0vRr9F2SiE",1086353921004785665,2019-01-18 20:05:32,19071682,"State College, PA",49,30,[]
905,RT @AccuAstronomy: A total lunar eclipse will be visible across North America on Sunday night (weather permitting) and will cause the Moon…,1086344096501977093,2019-01-18 19:26:30,19071682,"State College, PA",0,54,[]
906,"Pennsylvania Governor Tom Wolf has signed a state of emergency declaration, which enforces speed limit restrictions… https://t.co/cqTuH1aPWS",1086321388951142400,2019-01-18 17:56:16,19071682,"State College, PA",53,37,[]
907,"For this weekend's Australian Open, a turn to more comfortable weather this weekend will not hold through the secon… https://t.co/JeJXasoNe6",1086315332116144130,2019-01-18 17:32:12,19071682,"State College, PA",6,4,[]
908,"While the Midwest and Northeast are preparing for a snowstorm, the Deep South will experience severe thunderstorms… https://t.co/E2xTgNZKhr",1086292327637897216,2019-01-18 16:00:47,19071682,"State College, PA",12,12,[]
909,"A blast of frigid, windy weather will complicate travel and cleanup efforts across the region in the wake of the we… https://t.co/madf2eLwjC",1086266884897542144,2019-01-18 14:19:41,19071682,"State College, PA",20,12,[]
910,"Snowfall of 12-24 inches will be more common in the heaviest band from the upcoming snowstorm. However, close to 30… https://t.co/6Rwy2ijafW",1086233153507856385,2019-01-18 12:05:39,19071682,"State College, PA",30,15,[]
911,"Dense fog is overspreading the Deep South this morning, resulting in dangerously low visibility across the region.… https://t.co/s0g28zmbRp",1086212873473454082,2019-01-18 10:45:04,19071682,"State College, PA",4,4,[]
912,"The evening commute may be impacted by strong storms in the Dallas area today. On Saturday, the severe weather thre… https://t.co/vDOVWEnSis",1086199036066041856,2019-01-18 09:50:05,19071682,"State College, PA",7,13,[]
913,Players and fans will need to prepare for frigid weather in Kansas City on Sunday when the Chiefs take on the Patri… https://t.co/r3myMXnTpM,1086182677248643072,2019-01-18 08:45:05,19071682,"State College, PA",12,12,[]
914,"Snow showers developing over the Dakotas tonight are the first signs of a major winter storm, which will strengthen… https://t.co/twS1VmRfXa",1086163805548306432,2019-01-18 07:30:05,19071682,"State College, PA",29,22,[]
915,"After peaking above 100 F (37 C) earlier in the tournament, temperatures will remain closer to normal levels for th… https://t.co/v2A4RlQWDy",1086147438707134464,2019-01-18 06:25:03,19071682,"State College, PA",9,8,[]
916,"In the wake of this weekend's winter storm, temperatures in the Midwest and Northeast will plummet. On Monday, temp… https://t.co/0bjOIA9XFQ",1086129826283618304,2019-01-18 05:15:04,19071682,"State College, PA",21,12,[]
917,"Following tonight's quick-hitting burst of snow in the Northeast, a major winter storm is poised to slam into the r… https://t.co/z22YoOlDTR",1086109340493332480,2019-01-18 03:53:40,19071682,"State College, PA",63,30,[]
918,"A drying trend is in store for California following rounds of flooding rain, mudslides and feet of mountain snow:… https://t.co/9VJIOFqVJO",1086095147543265281,2019-01-18 02:57:16,19071682,"State College, PA",13,6,[]
919,"RT @ReedTimmerAccu: Update: Winter storm is still cranking at Mammoth Lakes, CA in the Sierra Nevada Mountains with winds surprisingly stro…",1086091922857512960,2019-01-18 02:44:27,19071682,"State College, PA",0,80,[]
