,tweet,id,time,user,location,favourites,retweet-count,hashtags
2417,"The current temperature of 14 F in Kansas City, MO, is lower than Fairbanks, AK (18 F): https://t.co/QKBidvEC1B

 https://t.co/qVcEJTuf1Q",1061143360101146624,2018-11-10 06:27:46,19071682,"State College, PA",22,16,[]
2418,Motorists in northern New England will need to use caution on the roadways overnight as heavy snow continues to fal… https://t.co/jyYPoDdVXu,1061123371340054528,2018-11-10 05:08:21,19071682,"State College, PA",11,8,[]
2419,"“Rainfall will be lacking from Colombia to French Guiana and north-central Brazil, resulting in developing or worse… https://t.co/H1pnWX542V",1061102408430956544,2018-11-10 03:45:03,19071682,"State College, PA",10,9,[]
2420,"RT @StormOfCorn: We're concerned about another ""spike"" in fire danger / volatile conditions that could lead to rapid fire growth again arou…",1061085122106220545,2018-11-10 02:36:21,19071682,"State College, PA",0,25,[]
2421,Update: There are now 9 confirmed fatalities in Northern California associated with the #CampFire:… https://t.co/bR8CeHtGTo,1061081540099260416,2018-11-10 02:22:07,19071682,"State College, PA",18,17,[CampFire]
2422,"The #WoolseyFire burning in Ventura County, California, has grown to 35,000 acres. President Donald Trump has appro… https://t.co/ThlHcouiLt",1061069883587379201,2018-11-10 01:35:48,19071682,"State College, PA",36,32,[WoolseyFire]
2423,"The death toll from the #CampFire has risen to 6 after raging through Paradise, California: https://t.co/Ox6SCM0Y7m https://t.co/FHQHkqMsBe",1061066656271814656,2018-11-10 01:22:59,19071682,"State College, PA",32,24,[CampFire]
2424,"Air quality concerns are rising across northern India due to a combination of pollution from factories, agricultura… https://t.co/AWD5N4uSmC",1061061651527557121,2018-11-10 01:03:05,19071682,"State College, PA",8,5,[]
2425,"RT @AccuAstronomy: This weekend is the peak of the northern Taurid #MeteorShower! 
This shower is known for bringing extremely bright meteo…",1061045704989294592,2018-11-09 23:59:44,19071682,"State College, PA",0,37,[MeteorShower]
2426,"A large storm may bring widespread snow, rain and travel disruptions to the eastern US during the first half of nex… https://t.co/BDpGewUUfj",1061034973766000640,2018-11-09 23:17:05,19071682,"State College, PA",52,34,[]
2427,"RT @StormOfCorn: A dessicating, gusty wind has led to explosive fire behavior in California. The Camp Fire in Butte Co has grown to 70,000…",1061021169070080001,2018-11-09 22:22:14,19071682,"State College, PA",0,34,[]
2428,"The #WoolseyFire has grown to 14,000 acres as Santa Ana winds whip Southern California: https://t.co/oxhaB7JFKk https://t.co/T79D2cUe7L",1061016225059241985,2018-11-09 22:02:35,19071682,"State College, PA",25,24,[WoolseyFire]
2429,"RT @CityMalibu: Fire is burning out of control, heading into populated areas of Malibu. All residents evacuate now https://t.co/Q3wJnger2Q",1060999968511721473,2018-11-09 20:57:59,19071682,"State College, PA",0,3064,[]
2430,"Rain, wind and snow will continue across the Northeast through Friday night and may interrupt the evening commute:… https://t.co/VeV5unc5vQ",1060994585885859846,2018-11-09 20:36:36,19071682,"State College, PA",13,12,[]
2431,"5 fatalities have been reported in Paradise, California, due to the #CampFire. At least 2,000 structures have been… https://t.co/RhRwNJY2Bi",1060974425540120576,2018-11-09 19:16:29,19071682,"State College, PA",48,57,[CampFire]
2432,People living in or traveling through the Great Lakes region should make sure their vehicle is set for wintry drivi… https://t.co/K4UHzlwaAX,1060964118470017024,2018-11-09 18:35:32,19071682,"State College, PA",17,17,[]
2433,"The raging #CampFire in Northern California has exploded to 70,000 acres in size. At least 15,000 structures are be… https://t.co/xn6v519FXy",1060942549676974082,2018-11-09 17:09:49,19071682,"State College, PA",16,28,[CampFire]
2434,"RT @CityMalibu: MANDATORY EVACUATION - all of City of Malibu, all areas S of 101 Fwy, Ventura County to Malibu Cyn https://t.co/W00a3MimKX",1060918349541109760,2018-11-09 15:33:40,19071682,"State College, PA",0,310,[]
2435,A storm will bury a large portion of Quebec and parts of central Ontario and northwestern New Brunswick in snow int… https://t.co/WLqXTlzhO9,1060917051110371328,2018-11-09 15:28:30,19071682,"State College, PA",26,13,[]
2436,RT @VCFD_PIO: Fire has jumped the 101 freeway at Liberty Canyon and is well established on the south side of the freeway.Avoid 101 of commu…,1060900816603766785,2018-11-09 14:23:59,19071682,"State College, PA",0,409,[]
2437,"75,000 homes are being evacuated in Ventura and Los Angeles counties due to the #WoolseyFire, which has burned 8,00… https://t.co/YOVl03ScqB",1060872911723130881,2018-11-09 12:33:06,19071682,"State College, PA",28,33,[WoolseyFire]
2438,"As a strong Santa Ana wind event continues in Southern California, evacuations are mounting in Ventura and Los Ange… https://t.co/Fm0hMVCiF0",1060849618781696000,2018-11-09 11:00:33,19071682,"State College, PA",11,8,[]
2439,"After an unseasonably chilly day with highs in the 30s F and RealFeels in the teens in Kansas City, MO, the tempera… https://t.co/pS1ZYz6x2q",1060831887042768897,2018-11-09 09:50:05,19071682,"State College, PA",8,5,[]
2440,"Track the #snow that continues to sweep through the Midwest on radar: https://t.co/UHqFMusumb

 https://t.co/k83UtL17ek",1060814266075373568,2018-11-09 08:40:04,19071682,"State College, PA",5,2,[snow]
2441,RT @ChicoFD: Current map of evacuation zones in the City of Chico. Firefighters continue to actively engage the fire in order to protect li…,1060810157205139456,2018-11-09 08:23:45,19071682,"State College, PA",0,550,[]
2442,"While the winds that fueled the raging Camp Fire in Northern California will slacken to end the week, a Santa Ana w… https://t.co/S6uisBWE4J",1060796655279185921,2018-11-09 07:30:05,19071682,"State College, PA",8,20,[]
2443,"The temperature soared to 89 F in Gainesville, Florida, on Thursday, breaking the daily record of 86 F set in 2003.… https://t.co/aG6PRAxA8d",1060779028943122433,2018-11-09 06:20:03,19071682,"State College, PA",8,13,[]
2444,"A fire captain reports that the town of Paradise, California, has been ""pretty much"" destroyed by the #CampFire. La… https://t.co/i1KY0O9FJp",1060761413759787013,2018-11-09 05:10:03,19071682,"State College, PA",40,51,[CampFire]
2445,"#Snow continues to fall across northern and central Missouri, with 1-3"" of accumulation reported in some areas. St.… https://t.co/LLOxMglWjj",1060743820801990656,2018-11-09 04:00:09,19071682,"State College, PA",12,3,[Snow]
2446,"Hundreds of structures have been destroyed around Paradise, California, as the #CampFire rages in Northern Californ… https://t.co/TKGj1nr87s",1060725879024824320,2018-11-09 02:48:51,19071682,"State College, PA",33,19,[CampFire]
2447,"A windstorm on Friday will be followed by a cold, blustery weekend in the UK: https://t.co/3pNuIcdPnf https://t.co/84ujrJtqeP",1060709726504259585,2018-11-09 01:44:40,19071682,"State College, PA",17,7,[]
2448,"Rain, wind and snow will spread across the Northeast on Friday ahead of a fresh blast of chilly air:… https://t.co/y495vZW6mL",1060694233496072193,2018-11-09 00:43:06,19071682,"State College, PA",21,14,[]
2449,"RT @StormOfCorn: The explosive Camp Fire has been fueled by a gusty wind, extremely low humidity, and a very, very dry start to the fall se…",1060689423531233281,2018-11-09 00:23:59,19071682,"State College, PA",0,27,[]
2450,"The #HillFire has erupted to over 8,000 acres in Southern California, forcing part of US 101 to close. More wildfir… https://t.co/meOSaTLhGP",1060676701787697152,2018-11-08 23:33:26,19071682,"State College, PA",23,22,[HillFire]
2451,"CORRECTION: The #CampFire has now burned at least 18,000 acres. A state of emergency has been declared in Butte Cou… https://t.co/8NxOMMgCBF",1060673241117810688,2018-11-08 23:19:41,19071682,"State College, PA",20,25,[CampFire]
2452,"UPDATE: The #CampFire has now burned at least 18,000 acres. A state of emergency has been delayed in Butte County,… https://t.co/Zz48ycrxEx",1060661555526811650,2018-11-08 22:33:15,19071682,"State College, PA",78,65,[CampFire]
2453,RT @jpetramala: A couple of early #snow days so far this season for #KansasCity @accuweather @breakingweather https://t.co/KmHWEzzvLK,1060657488779984899,2018-11-08 22:17:06,19071682,"State College, PA",0,3,"[snow, KansasCity]"
2454,The 1st accumulating snowfall of season will fall in parts of midwestern US through Friday: https://t.co/m9eAMcW14b https://t.co/JvW8Pb70Gz,1060655118075510785,2018-11-08 22:07:40,19071682,"State College, PA",17,7,[]
2455,"The #CampFire has rapidly grown over 8,000 acres in northern California with thousands of people ordered to evacuat… https://t.co/6QYPuqHCAl",1060636982752223233,2018-11-08 20:55:37,19071682,"State College, PA",57,56,[CampFire]
2456,Heavy showers and thunderstorms will bring a month's worth of rain to parts of Argentina and Uruguay:… https://t.co/br5dR8L7ms,1060618969688784898,2018-11-08 19:44:02,19071682,"State College, PA",9,7,[]
2457,The first widespread and heavy lake-effect snow event of the season is set to roll for the Upper Midwest and interi… https://t.co/Xf8efCoJlz,1060597839624105984,2018-11-08 18:20:04,19071682,"State College, PA",24,16,[]
2458,RT @NWSSacramento: Latest satellite images of #Campfire.  Smoke plume is spreading south and east across Sacramento Valley. #CaWx https://t…,1060597198461825031,2018-11-08 18:17:31,19071682,"State College, PA",0,214,"[Campfire, CaWx]"
2459,"Evacuations are underway for the very dangerous Camp Fire in Butte County, CA: https://t.co/LfwBFjmuY7 https://t.co/UA4RgPQOPY",1060588097098993665,2018-11-08 17:41:21,19071682,"State College, PA",702,566,[]
2460,A late-week storm will bring much colder air to the northeastern United States. Northerly and high-elevation locati… https://t.co/8Yeffn2MNB,1060581490420080641,2018-11-08 17:15:06,19071682,"State College, PA",18,12,[]
2461,@sokkarockedya Hello! Thank you for contacting us about the incorrect temperatures. We are actively working on this… https://t.co/TCxCMSWCbJ,1060576544249253892,2018-11-08 16:55:27,19071682,"State College, PA",0,0,[]
2462,Cyclone Alcide will  threaten Madagascar into next week: https://t.co/LPuV7I9p1k https://t.co/redKPjoajP,1060568899782168576,2018-11-08 16:25:04,19071682,"State College, PA",10,7,[]
2463,A look at the road conditions across Nebraska at this hour as the state continues to receive snow. Image via… https://t.co/jLhKHGebgv,1060549467517210624,2018-11-08 15:07:51,19071682,"State College, PA",7,6,[]
2464,"A storm will lay a swath of snow and slick travel across the Midwest through Friday, with some areas expected to pi… https://t.co/rBho8RIkCd",1060527039474778114,2018-11-08 13:38:44,19071682,"State College, PA",64,38,[]
2465,A powerful storm will bring rounds of rain to Spain and France this weekend: https://t.co/WHOnrXSjF0 https://t.co/8nc5KAMkNG,1060503694922407937,2018-11-08 12:05:58,19071682,"State College, PA",12,10,[]
2466,"Into the evening hours, snow will spread along the Interstate 70 and I-80 corridors of Kansas and Nebraska, leading… https://t.co/sJIBupvhcV",1060478945387335680,2018-11-08 10:27:37,19071682,"State College, PA",9,9,[]
2467,"While a normal high temperature in Minneapolis is in the middle 40s F, the city's temperature may not get out of th… https://t.co/ghMKcPuHFm",1060457020980109312,2018-11-08 09:00:30,19071682,"State College, PA",10,13,[]
2468,Cyclone #Alcide may impact areas from Madagascar to Reunion and Mauritius in the coming days:… https://t.co/bcgQgoY2lg,1060439292240187392,2018-11-08 07:50:03,19071682,"State College, PA",14,17,[Alcide]
2469,"While Houston has spent the past 2 days near 90 F, highs will only be in the 50s F by the weekend:… https://t.co/EgO7a2TQxY",1060421688230379520,2018-11-08 06:40:06,19071682,"State College, PA",24,17,[]
2470,"Red flag warnings are in effect across Northern California into Friday, with winds expected to ramp up tonight:… https://t.co/DyJ7lSpEzI",1060404068294758400,2018-11-08 05:30:05,19071682,"State College, PA",16,9,[]
2471,"Heavy, locally severe storms are sweeping through southeast Texas and southern Louisiana at this hour. Latest sever… https://t.co/vGmakLNIRc",1060386449894359040,2018-11-08 04:20:05,19071682,"State College, PA",17,9,[]
2472,Waves of cold will keep the northern Plains and Midwest feeling wintry through the end of this week and into the be… https://t.co/9tGtIjyHdS,1060368954919714816,2018-11-08 03:10:34,19071682,"State College, PA",23,14,[]
2473,"There are several reports of trees down on I-475 southbound in Macon, Georgia after a severe storm rolled through t… https://t.co/KaLS5HqXAm",1060345795944374273,2018-11-08 01:38:32,19071682,"State College, PA",37,19,[]
2474,"With cold air diving southward through the Plains, snow will fall across the country's midsection before week's end… https://t.co/SevTjsiqZb",1060336184659009536,2018-11-08 01:00:21,19071682,"State College, PA",10,8,[]
2475,"The  @NWS doppler radar indicated a strong thunderstorm over Summertown, Georgia moving northeast at 35 mph. Gusty… https://t.co/59iNx4waur",1060317469167046657,2018-11-07 23:45:59,19071682,"State College, PA",5,3,[]
2476,South America summer forecast: Frequent rounds of rain and thunderstorms will bring the threat of flooding from Ecu… https://t.co/N5VpK9CoZg,1060303398971588609,2018-11-07 22:50:04,19071682,"State College, PA",18,12,[]
2477,"Air quality concerns are rising across northern India due to a combination of pollution from factories, agricultura… https://t.co/M74OvEQuKi",1060283292170289153,2018-11-07 21:30:10,19071682,"State College, PA",6,8,[]
2478,AccuWeather RealFeel® temperatures will plummet below 0 F in parts of  the north-central US on Friday as frigid air… https://t.co/knCJdqooNc,1060263137956503557,2018-11-07 20:10:05,19071682,"State College, PA",22,11,[]
2479,"The end of the week will bring disruptive rain, snow and wind to much of the northeastern US:… https://t.co/GccFBYQEP5",1060243008896098307,2018-11-07 18:50:06,19071682,"State College, PA",24,27,[]
2480,"Accumulating snow will spread across portions of the centra US tonight, bringing the first snow of the season for s… https://t.co/GAnUUfJHmt",1060224151884050432,2018-11-07 17:35:10,19071682,"State College, PA",25,16,[]
2481,"Strong winds will whip through Northern and Southern California into the end of the week, heightening the risk of w… https://t.co/pqcDNGoSW4",1060206207930155009,2018-11-07 16:23:52,19071682,"State College, PA",12,10,[]
2482,"Drought concerns will build from Colombia through northern Brazil this summer, while rain and thunderstorms limit t… https://t.co/CqfFQCUua0",1060173769266917381,2018-11-07 14:14:58,19071682,"State College, PA",12,9,[]
2483,A pattern change will cause temperatures to plummet across parts of the northern Plains and Midwest this week:… https://t.co/JqrpGpZpjv,1060148590184669185,2018-11-07 12:34:55,19071682,"State College, PA",8,10,[]
2484,A stormy weather pattern is set to grip the United Kingdom into this weekend and may include a named windstorm:… https://t.co/cW9Cqo8wzO,1060114653588738049,2018-11-07 10:20:04,19071682,"State College, PA",13,9,[]
2485,"#Alcide, the first named storm of the 2018-2019 cyclone season, will threaten areas from #Madagascar to #Reunion an… https://t.co/XhQ4iItqnj",1060094634469326850,2018-11-07 09:00:31,19071682,"State College, PA",14,22,"[Alcide, Madagascar, Reunion]"
2486,"Philadelphia received 1.65"" of rain on Tuesday, which broke the daily record of 1.41"" from 1963. Drier weather will… https://t.co/v9o679eG3u",1060076910015844352,2018-11-07 07:50:05,19071682,"State College, PA",11,11,[]
2487,"While calm weather will prevail in California on Wednesday, gusty winds will whip up by Thursday, heightening the f… https://t.co/2PCsZwkZrP",1060059293213442049,2018-11-07 06:40:05,19071682,"State College, PA",7,10,[]
2488,"Oklahoma City got up to 71 F (5 degrees above normal) on Tuesday, but will only be in the mid-50s F at midweek with… https://t.co/D2MSnfwnAA",1060041677803524096,2018-11-07 05:30:05,19071682,"State College, PA",9,9,[]
2489,"Duluth, Minnesota, has started the month of November with above-normal snowfall, and the city is getting another do… https://t.co/Bh6pGbwYge",1060024055108120578,2018-11-07 04:20:03,19071682,"State College, PA",13,4,[]
2490,"High temperatures will struggle to reach the 30-degree Fahrenheit mark in Bismarck, North Dakota, through Friday:… https://t.co/u7F2NzdkKA",1060003941470081025,2018-11-07 03:00:08,19071682,"State College, PA",33,18,[]
2491,"Stormy weather, including more wind, rain and even some snowflakes, is likely to return to the Northeast at the end… https://t.co/YprCQYP2xS",1059986304908386314,2018-11-07 01:50:03,19071682,"State College, PA",25,22,[]
2492,"With cold air diving southward through the Plains, snow will fall across the country's midsection before week's end… https://t.co/EFc4L8zYsm",1059970672540168193,2018-11-07 00:47:56,19071682,"State College, PA",12,9,[]
2493,Waves of cold will keep the northern Plains and Midwest feeling wintry through the end of this week and into the be… https://t.co/0tG43nzi3t,1059950493731119105,2018-11-06 23:27:45,19071682,"State College, PA",21,12,[]
2494,"There is more than a 100-degree difference in the AccuWeather RealFeel® temperature across the central US, ranging… https://t.co/FZeprCwpgw",1059928432497381381,2018-11-06 22:00:05,19071682,"State College, PA",14,7,[]
2495,"RT @ReedTimmerAccu: Update: @NWSMemphis damage survey has confirmed a #tornado of at least EF1 across north side of Tupelo, MS. This neighb…",1059927283392225281,2018-11-06 21:55:31,19071682,"State College, PA",0,66,[tornado]
2496,Some precincts across the eastern US opened late on Tuesday following severe thunderstorms on Monday night. Rain al… https://t.co/WoQ2SXhOPo,1059922869222887424,2018-11-06 21:37:59,19071682,"State College, PA",14,5,[]
2497,"A storm will deliver rain, snow and wind to the northeastern United States at the end of the week:… https://t.co/dk3qgoRsOf",1059908434349473793,2018-11-06 20:40:37,19071682,"State College, PA",25,24,[]
2498,A change in the weather pattern will send waves of chilly air across the central and eastern US this weekend and in… https://t.co/JJoyNimbbS,1059888139135827968,2018-11-06 19:19:58,19071682,"State College, PA",19,15,[]
2499,RT @AccuRayno: Ready for snow early next week ? https://t.co/CFal38lWQb,1059856488380928001,2018-11-06 17:14:12,19071682,"State College, PA",0,20,[]
2500,"One fatality has been confirmed in Christiana, Tennessee, after tornadoes tracked through the region on Monday nigh… https://t.co/vdE2CD8vjW",1059856247544078336,2018-11-06 17:13:15,19071682,"State College, PA",40,33,[]
2501,A series of storms will unleash wind and rain across the UK into this weekend: https://t.co/76kxTUQ4H4 https://t.co/wpzoYQcbHP,1059843184350642179,2018-11-06 16:21:20,19071682,"State College, PA",8,7,[]
2502,RT @jpetramala: Getting my first look at a house damaged by an overnight fire officials blame on a possible lightning strike. No one hurt t…,1059836687721922562,2018-11-06 15:55:31,19071682,"State College, PA",0,12,[]
2503,RT @NCSBE: .@NCSBE is receiving reports from county BOEs and voters about ballot tabulation issues caused by humidity. All ballots will be…,1059828639154487296,2018-11-06 15:23:32,19071682,"State College, PA",0,98,[]
2504,Some snow and a wintry mix is forecast for parts of the central US as arctic air plunges southward:… https://t.co/suMoTjYZTk,1059817733595058178,2018-11-06 14:40:12,19071682,"State College, PA",10,14,[]
2505,RT @jpetramala: Line out of the door as this polling place in #Nashville opened this morning. Voters telling me they are thankful the bad w…,1059799333070143488,2018-11-06 13:27:05,19071682,"State College, PA",0,4,[Nashville]
2506,"Some wind gusts could surpass 50 mph, strong enough to cause localized damage and sporadic power outages, in the No… https://t.co/Fj3jvTs40F",1059792330516062208,2018-11-06 12:59:16,19071682,"State College, PA",12,16,[]
2507,"As of 6AM EST, several East Coast states have opened polling stations for the day. Voters heading out today in the… https://t.co/J0POhfmbFa",1059766110386618368,2018-11-06 11:15:04,19071682,"State College, PA",15,20,[]
2508,"Diwali will begin this week across India with widespread fireworks celebrations, marking an annual surge in poor ai… https://t.co/rtAmTrbGrV",1059751007058620416,2018-11-06 10:15:03,19071682,"State College, PA",8,2,[]
2509,The same system bringing severe weather through Tennessee and Alabama tonight will move into the mid-Atlantic later… https://t.co/mBcnAdqtzj,1059735912261840896,2018-11-06 09:15:05,19071682,"State College, PA",9,18,[]
2510,"A dangerous severe weather event continues to unfold across Mississippi, Alabama and Tennessee, with widespread dam… https://t.co/VYLOQP0JrI",1059717116033667073,2018-11-06 08:00:23,19071682,"State College, PA",17,11,[]
2511,"@ReedTimmerAccu is tracking a series of storms stretching from central Mississippi to Tennessee tonight, a few of w… https://t.co/hsLB3kev9L",1059701978761232386,2018-11-06 07:00:14,19071682,"State College, PA",1,1,[]
2512,"Foggy conditions are forming up and down the East Coast, resulting in flight delays at major airline hubs such as t… https://t.co/kLNbUqj3UI",1059686847008387073,2018-11-06 06:00:07,19071682,"State College, PA",6,11,[]
2513,Breckenridge and Keystone ski resorts have announced they are opening ahead of schedule. Plenty of snow has blanket… https://t.co/QgZUjRXHQt,1059664189411737600,2018-11-06 04:30:05,19071682,"State College, PA",28,18,[]
2514,"There are reports of a possible tornado near Burgess in western Lafayette County, just north of Oxford, Mississippi… https://t.co/W9RfzZtrBe",1059643340466122752,2018-11-06 03:07:14,19071682,"State College, PA",15,8,[]
2515,These storms will bring an added danger after nightfall as they will be difficult to see as they approach:… https://t.co/YjuWJNnAHH,1059628761551982593,2018-11-06 02:09:18,19071682,"State College, PA",22,6,[]
2516,"Tornado damage has been reported near Highway 1221 in Marthaville, Louisiana as well as Natchitoches, Louisiana. Im… https://t.co/E7Gx2MbqMf",1059610743958585349,2018-11-06 00:57:42,19071682,"State College, PA",20,9,[]
2517,"@ReedTimmerAccu is chasing a #tornado warned lead supercell west of Columbia, Louisiana as of 5:40 p.m. CST. These… https://t.co/QlYSJng5mz",1059595250795274248,2018-11-05 23:56:08,19071682,"State College, PA",5,2,[tornado]
2518,RT @ReedTimmerAccu: CONFIRMeD TORNADO just west of Atlanta LA as of 443 pm headinb northeast at 35 mph! Watch out Winnfield area @breakingw…,1059577808949862400,2018-11-05 22:46:50,19071682,"State College, PA",0,36,[]
2519,"A confirmed #tornado is located near Natchitoches, Louisiana, and is approaching Saint Maurice. Take cover!… https://t.co/WjRYZlZYDJ",1059570390299803649,2018-11-05 22:17:21,19071682,"State College, PA",15,19,[tornado]
2520,Severe thunderstorms will shift into the mid-Atlantic for #ElectionDay with damaging winds and flooding downpours:… https://t.co/rqqXNfaYmP,1059567983973023744,2018-11-05 22:07:47,19071682,"State College, PA",11,16,[ElectionDay]
2521,Severe storms will likely spin up a few tornadoes over part of the southeastern US this afternoon and into tonight… https://t.co/Ni3rZHM2iL,1059547166455353344,2018-11-05 20:45:04,19071682,"State College, PA",14,15,[]
2522,"Voter turnout for Tuesday’s midterm elections may be affected by rain, storms and wind across the eastern US… https://t.co/wzn5Rl5nRd",1059527038674108416,2018-11-05 19:25:05,19071682,"State College, PA",11,19,[]
2523,"Arctic air will dive into the central US later this week, bringing the opportunity for snow: https://t.co/siJu2QizUi https://t.co/3l6FQysjOO",1059508167409836033,2018-11-05 18:10:06,19071682,"State College, PA",32,16,[]
2524,"A late-week storm will unleash rain, wind and snow across the northeastern US: https://t.co/3KxxJ2XGHg https://t.co/JM3jiszHuR",1059488805172977664,2018-11-05 16:53:10,19071682,"State College, PA",24,21,[]
2525,"Later this week, a slight wind shift is expected to kick up another Santa Ana wind event across an otherwise dry an… https://t.co/Dr9OX98rtG",1059467980336254976,2018-11-05 15:30:25,19071682,"State College, PA",10,5,[]
2526,Severe thunderstorms will threaten areas from northern Louisiana to Ohio later today: https://t.co/uw3CFcq5DV https://t.co/qbadd42PDF,1059442174490755073,2018-11-05 13:47:52,19071682,"State College, PA",23,13,[]
2527,"Voter turnout for Tuesday’s midterm elections may be affected as a potent storm unleashes rain, strong winds and po… https://t.co/Wp6gtU0apd",1059421190593363969,2018-11-05 12:24:29,19071682,"State College, PA",11,15,[]
2528,"Tie down those decorations: Windy conditions are expected to pick up across the Midwest and Northeast on Tuesday, p… https://t.co/6vmaJ8E2y8",1059400093718274050,2018-11-05 11:00:39,19071682,"State College, PA",20,17,[]
2529,"Residents of the southern US and Ohio Valley will need to keep a close eye on the weather today, as severe storms a… https://t.co/NgYoqEaAS3",1059381071459049472,2018-11-05 09:45:04,19071682,"State College, PA",13,8,[]
2530,"It has rained in Cleveland, Ohio daily since the start of the month, supplying the city with 83% of its normal Nove… https://t.co/UGUI8jrt5C",1059362205697748992,2018-11-05 08:30:06,19071682,"State College, PA",7,6,[]
